,truncated,text,is_quote_status,id,favorite_count,source,retweeted,id_str,retweet_count,favorited,lang,created_at,clean_text
1333,False,"Thank you to everyone for all of the nice comments, by Twitter, pundits and otherwise for my speech last night.",False,766627569110249472,33275,iphone,False,766627569110249472,7581,False,en,Fri Aug 19 13:27:10 +0000 2016,thank everyone nice comments twitter pundits otherwise speech last night
1334,False,"The reporting at the failing @nytimes gets worse and worse by the day. Fortunately, it is a dying newspaper.",False,766616610975182848,20634,iphone,False,766616610975182848,5717,False,en,Fri Aug 19 12:43:37 +0000 2016,reporting failing @nytimes gets worse worse day fortunately dying newspaper
1335,False,Thank you to NC for last evenings great reception. The speech was a great success. Heading now to Louisiana &amp; another speech tonight in MI.,False,766616361720246272,24196,iphone,False,766616361720246272,5762,False,en,Fri Aug 19 12:42:38 +0000 2016,thank nc last evenings great reception speech great success heading louisiana amp another speech tonight mi
1336,False,"We are one nation. When one state hurts, we all hurt. We must all work together - to lift each other up. https://t.co/XoDkW5X3Wy",False,766585563805802497,45110,iphone,False,766585563805802497,16531,False,en,Fri Aug 19 10:40:15 +0000 2016,one nation one state hurts hurt must work together lift
1337,False,"Thank you Charlotte, North Carolina!
#MakeAmericaGreatAgain 
https://t.co/Y19nUKkYTc",False,766437671652556800,17426,iphone,False,766437671652556800,4740,False,en,Fri Aug 19 00:52:35 +0000 2016,thank charlotte north carolina makeamericagreatagain
1338,False,"Together, we will MAKE AMERICA GREAT AGAIN! https://t.co/aENuIvrUrS",False,766432970441945088,18578,iphone,False,766432970441945088,6703,False,en,Fri Aug 19 00:33:54 +0000 2016,together make america great
1339,False,#CrookedHillary #ThrowbackThursday https://t.co/v8J0r64J7h,False,766378021355921408,46450,ipad,False,766378021355921408,27288,False,und,Thu Aug 18 20:55:33 +0000 2016,crookedhillary throwbackthursday
1340,False,They will soon be calling me MR. BREXIT!,False,766246213079498752,38689,android,False,766246213079498752,17650,False,en,Thu Aug 18 12:11:48 +0000 2016,soon calling mr brexit
1341,False,I will be doing a Town Hall tonight at 10:00 P.M. on @seanhannity - @FoxNews,False,766082563064623105,14552,android,False,766082563064623105,3493,False,en,Thu Aug 18 01:21:30 +0000 2016,town hall tonight p @seanhannity @foxnews
1342,False,Will be participating in a town hall event- hosted by @SeanHannity tonight at 10pmE on @FoxNews. Enjoy! https://t.co/7nReqYM7FF,False,766038151206936576,20373,iphone,False,766038151206936576,5750,False,en,Wed Aug 17 22:25:02 +0000 2016,participating town hall event hosted @seanhannity tonight pme @foxnews enjoy
1343,False,"We are going to make this a government of the people once again!
#MakeAmericaGreatAgain #ImWithYou
https://t.co/Fi7yEb2XQb",False,766028026987491328,24771,web,False,766028026987491328,9750,False,en,Wed Aug 17 21:44:48 +0000 2016,going make government people makeamericagreatagain imwithyou
1344,False,"We will repeal &amp; replace #Obamacare, which has caused soaring double-digit premium increases. It is a disaster! https://t.co/NNMyTJo6i6",False,766002945485864961,27204,web,False,766002945485864961,9884,False,en,Wed Aug 17 20:05:08 +0000 2016,repeal amp replace obamacare caused soaring double digit premium increases disaster
1345,False,"A vote for Hillary Clinton is a vote for another generation of poverty, high crime, &amp; lost opportunities. #ImWithYou
https://t.co/Eph6qy7zyB",False,765955844055760896,37268,web,False,765955844055760896,15941,False,en,Wed Aug 17 16:57:58 +0000 2016,vote hillary clinton vote another generation poverty high crime amp lost opportunities imwithyou
1346,False,"#MakeAmericaSafeAgain #ImWithYou
https://t.co/N9XNoGNcqc",False,765953073072058368,16425,web,False,765953073072058368,6056,False,und,Wed Aug 17 16:46:57 +0000 2016,makeamericasafeagain imwithyou
1347,False,"Thank you Governor @ScottWalker &amp; @GOP Chairman @Reince Priebus. 
#MakeAmericaGreatAgain #ImWithYou
https://t.co/IdJBuaKMwK",False,765950471160954884,15562,iphone,False,765950471160954884,5503,False,en,Wed Aug 17 16:36:37 +0000 2016,thank governor @scottwalker amp @gop chairman @reince priebus makeamericagreatagain imwithyou
1348,False,"Join me in North Carolina - tomorrow at 7:30pm! #ImWithYou 
Tickets: https://t.co/vDag45zrDc",False,765902170084483073,11109,iphone,False,765902170084483073,3583,False,en,Wed Aug 17 13:24:41 +0000 2016,join north carolina tomorrow pm imwithyou tickets
1349,False,"#LawandOrder #ImWithYou
Video: https://t.co/AIa2Z9po2h https://t.co/qqSfOfgdap",False,765769891278381056,15076,iphone,False,765769891278381056,5409,False,en,Wed Aug 17 04:39:04 +0000 2016,lawandorder imwithyou video
1350,False,"#LawandOrder #ImWithYou
Transcript: https://t.co/YlATGI2Ph6",False,765765603743391744,12424,iphone,False,765765603743391744,4377,False,en,Wed Aug 17 04:22:01 +0000 2016,lawandorder imwithyou transcript
1351,False,Will be on @SeanHannity tonight at 10pmE - delivering an important speech live from Wisconsin. #MakeAmericaGreatAgain,False,765726909925851136,16125,iphone,False,765726909925851136,4074,False,en,Wed Aug 17 01:48:16 +0000 2016,@seanhannity tonight pme delivering important speech live wisconsin makeamericagreatagain
1352,False,"Just as we won the Cold War, in part, by exposing the evils of communism and the virtues of free markets....
Cont: https://t.co/SXp7efXEZU",False,765688915932045313,17088,iphone,False,765688915932045313,5862,False,en,Tue Aug 16 23:17:18 +0000 2016,cold war part exposing evils communism virtues free markets cont
1353,False,This is my pledge to the American people: https://t.co/Jb21oyNfxt,False,765679267086684161,18444,iphone,False,765679267086684161,7637,False,en,Tue Aug 16 22:38:57 +0000 2016,pledge american people
1354,False,"'It's just a 2-point race, Clinton 38%, Trump 36%' https://t.co/EzDzJ4EzIN",False,765629939811020802,17186,iphone,False,765629939811020802,6998,False,en,Tue Aug 16 19:22:57 +0000 2016,point race clinton trump
1355,False,Another health insurer is pulling back due to 'persistent financial losses on #Obamacare plans.' Only the beginning! https://t.co/YqfaEvg8c3,False,765623972234948608,21283,iphone,False,765623972234948608,9876,False,en,Tue Aug 16 18:59:14 +0000 2016,another health insurer pulling back due persistent financial losses obamacare plans beginning
1356,False,#AmericasMerkel https://t.co/QFRs4bEUC1,False,765284051938926592,22218,iphone,False,765284051938926592,11130,False,und,Mon Aug 15 20:28:30 +0000 2016,americasmerkel
1357,False,"""CLINTON REFUGEE PLAN COULD BRING IN 620,000 REFUGEES IN FIRST TERM AT LIFETIME COST OF OVER $400 BILLION."" https://t.co/COZQNt6KVs",False,765283490887790592,22744,iphone,False,765283490887790592,13363,False,en,Mon Aug 15 20:26:17 +0000 2016,clinton refugee plan could bring refugees first term lifetime cost billion
1358,False,"#MakeAmericaSafeAgain 
https://t.co/bgBGPaKaqI",False,765269114973720576,14691,iphone,False,765269114973720576,5458,False,und,Mon Aug 15 19:29:09 +0000 2016,makeamericasafeagain
1359,False,Certain Republicans who have lost to me would rather save face by fighting me than see the U.S.Supreme Court get proper appointments. Sad!,False,764998650598686721,46625,android,False,764998650598686721,15058,False,en,Mon Aug 15 01:34:25 +0000 2016,certain republicans lost would rather save face fighting see u supreme court get proper appointments sad
1360,False,"""Stay on message"" is the chant. I always do - trade, jobs, military, vets, 2nd A, repeal Ocare, borders, etc - but media misrepresents!",False,764976828914237440,36509,android,False,764976828914237440,12420,False,en,Mon Aug 15 00:07:43 +0000 2016,stay message chant always trade jobs military vets nd repeal ocare borders etc media misrepresents
1361,False,I have always been the same person-remain true to self.The media wants me to change but it would be very dishonest to supporters to do so!,False,764974286931169285,40559,android,False,764974286931169285,12449,False,en,Sun Aug 14 23:57:37 +0000 2016,always person remain true self media wants change would dishonest supporters
1362,False,"It is not ""freedom of the press"" when newspapers and others are allowed to say and write whatever they want even if it is completely false!",False,764870785634799617,49079,android,False,764870785634799617,17447,False,en,Sun Aug 14 17:06:20 +0000 2016,freedom press newspapers others allowed say write whatever want even completely false
1363,False,"I am not only fighting Crooked Hillary, I am fighting the dishonest and corrupt media and her government protection process. People get it!",False,764867963845484545,51974,android,False,764867963845484545,17975,False,en,Sun Aug 14 16:55:07 +0000 2016,fighting crooked hillary fighting dishonest corrupt media government protection process people get
1364,False,Crooked Hillary Clinton is being protected by the media. She is not a talented person or politician. The dishonest media refuses to expose!,False,764866887511572480,38618,android,False,764866887511572480,13615,False,en,Sun Aug 14 16:50:51 +0000 2016,crooked hillary clinton protected media talented person politician dishonest media refuses expose
1365,False,My rallies are not covered properly by the media. They never discuss the real message and never show crowd size or enthusiasm.,False,764805340823248896,39584,android,False,764805340823248896,12522,False,en,Sun Aug 14 12:46:17 +0000 2016,rallies covered properly media never discuss real message never show crowd size enthusiasm
1366,False,"If the disgusting and corrupt media covered me honestly and didn't put false meaning into the words I say, I would be beating Hillary by 20%",False,764803159692836864,49146,android,False,764803159692836864,16538,False,en,Sun Aug 14 12:37:37 +0000 2016,disgusting corrupt media covered honestly put false meaning words say would beating hillary
1367,False,"The failing @nytimes, which never spoke to me, keeps saying that I am saying to advisers that I will change. False, I am who I am-never said",False,764801590415024128,24630,android,False,764801590415024128,7738,False,en,Sun Aug 14 12:31:23 +0000 2016,failing @nytimes never spoke keeps saying saying advisers change false never said
1368,False,The failing @nytimes talks about anonymous sources and meetings that never happened. Their reporting is fiction. The media protects Hillary!,False,764799933325144064,28121,android,False,764799933325144064,9353,False,en,Sun Aug 14 12:24:48 +0000 2016,failing @nytimes talks anonymous sources meetings never happened reporting fiction media protects hillary
1369,False,"""@zulu_out: You are a man for the people because you know what it is like to be among the people #MakeAmericaGreatAgain #USA Loves U"" Thanks",False,764554121324204033,18020,android,False,764554121324204033,4975,False,en,Sat Aug 13 20:08:01 +0000 2016,@zulu man people know like among people makeamericagreatagain usa loves u thanks
1370,False,"""@PaulaDuvall2: We're all enjoying you, as well, Mr. T.! You've inspired Hope and a Positive Spirit throughout America! God bless you!"" Nice",False,764553771879899137,17365,android,False,764553771879899137,4620,False,en,Sat Aug 13 20:06:38 +0000 2016,@pauladuvall enjoying well mr inspired hope positive spirit throughout america god bless nice
1371,False,"""@need2knowu:  @willspeakout yes you are my hero I admire you for laying down your glorious luxurious life to get beat up for America!!!""",False,764553088204214272,17737,android,False,764553088204214272,4992,False,en,Sat Aug 13 20:03:55 +0000 2016,@need knowu @willspeakout yes hero admire laying glorious luxurious life get beat america
1372,False,We now have confirmation as to one reason Crooked H wanted to be sure that nobody saw her e-mails - PAY-FOR-PLAY. How can she run for Pres.,False,764552764177481728,32224,android,False,764552764177481728,12439,False,en,Sat Aug 13 20:02:38 +0000 2016,confirmation one reason crooked h wanted sure nobody saw e mails pay play run pres
1373,False,"""@willspeakout: Thank you for all that you are doing for us! You campaign endlessly and have spent millions.We love you! #TrumpTrain"" Thanks",False,764546914683682817,18770,android,False,764546914683682817,5305,False,en,Sat Aug 13 19:39:23 +0000 2016,@willspeakout thank us campaign endlessly spent millions love trumptrain thanks
1374,False,I am truly enjoying myself while running for president. The people of our country are amazing - great numbers on November 8th!,False,764531827168186369,43901,android,False,764531827168186369,11916,False,en,Sat Aug 13 18:39:26 +0000 2016,truly enjoying running president people country amazing great numbers november th
1375,False,The failing @nytimes has become a newspaper of fiction. Their stories about me always quote non-existent unnamed sources. Very dishonest!,False,764529295901528064,28809,android,False,764529295901528064,9283,False,en,Sat Aug 13 18:29:23 +0000 2016,failing @nytimes become newspaper fiction stories always quote non existent unnamed sources dishonest
1376,False,"Will be on @seanhannity tonight at 10pm, hosted by @GovMikeHuckabee. Enjoy!",False,764254551822196737,16247,iphone,False,764254551822196737,4124,False,en,Sat Aug 13 00:17:38 +0000 2016,@seanhannity tonight pm hosted @govmikehuckabee enjoy
1377,False,"Thank you Erie, Pennsylvania! Together we will #MakeAmericaGreatAgain! https://t.co/5hZp7PnRoT",False,764186768522420224,23124,iphone,False,764186768522420224,7648,False,en,Fri Aug 12 19:48:18 +0000 2016,thank erie pennsylvania together makeamericagreatagain
1378,False,Unbelievable support in Florida last night - thank you! #MAGA https://t.co/WNDAagFRRS,False,764153606765412352,23741,iphone,False,764153606765412352,7568,False,en,Fri Aug 12 17:36:31 +0000 2016,unbelievable support florida last night thank maga
1379,False,ISIS gained tremendous strength during Hillary Clinton's term as Secretary of State. When will the dishonest media report the facts!,False,764084294704697344,38850,android,False,764084294704697344,15005,False,en,Fri Aug 12 13:01:06 +0000 2016,isis gained tremendous strength hillary clinton term secretary state dishonest media report facts
1380,False,"I love watching these poor, pathetic people (pundits) on television working so hard and so seriously to try and figure me out. They can't!",False,764064821000056832,40927,android,False,764064821000056832,13553,False,en,Fri Aug 12 11:43:43 +0000 2016,love watching poor pathetic people pundits television working hard seriously try figure
1381,False,A massive tax increase will be necessary to fund Crooked Hillary Clinton's agenda. What a terrible (and boring) rollout that was yesterday!,False,764055793951834114,32533,android,False,764055793951834114,10127,False,en,Fri Aug 12 11:07:51 +0000 2016,massive tax increase necessary fund crooked hillary clinton agenda terrible boring rollout yesterday
1382,False,"""@laurencristmann: Thank you for coming to Pennsylvania today. I will be there with @C_Lynne_Ryan your 3rd CD delegate at 2 pm""",False,764053208394182656,12152,android,False,764053208394182656,3022,False,en,Fri Aug 12 10:57:34 +0000 2016,@laurencristmann thank coming pennsylvania today @c lynne ryan rd cd delegate pm
1383,False,"Ratings challenged @CNN reports so seriously that I call President Obama (and Clinton) ""the founder"" of ISIS, &amp; MVP. THEY DON'T GET SARCASM?",False,764045345332396032,24450,android,False,764045345332396032,7926,False,en,Fri Aug 12 10:26:20 +0000 2016,ratings challenged @cnn reports seriously call president obama clinton founder isis amp mvp get sarcasm
1384,False,"""@EnemyWithinn: @realDonaldTrump @elsolarverde @nytimes People gotta stop believing media lies about Trump."" That would indeed be nice!",False,763950742755434498,20921,android,False,763950742755434498,6755,False,en,Fri Aug 12 04:10:25 +0000 2016,@enemywithinn @realdonaldtrump @elsolarverde @nytimes people gotta stop believing media lies trump would indeed nice
1385,False,"""@elsolarverde: THE CORRUPT MEDIA CREATS CONTROVERSY AGAINST @realDonaldTrump TO AVOID ISSUES ABOUT HillaryClinton https://t.co/RW5UcWLfA8""",False,763949723833118721,26976,android,False,763949723833118721,11723,False,en,Fri Aug 12 04:06:22 +0000 2016,@elsolarverde corrupt media creats controversy @realdonaldtrump avoid issues hillaryclinton
1386,False,"""@SheriffClarke: https://t.co/G9R9CGhf8q Everything coming from this administration is a lie. Only @realDonaldTrump will change it""",False,763947916184522754,15556,android,False,763947916184522754,6389,False,en,Fri Aug 12 03:59:11 +0000 2016,@sheriffclarke everything coming administration lie @realdonaldtrump change
1387,False,Will be doing @oreillyfactor tonight at 8pm. Enjoy!,False,763857902490836992,15949,iphone,False,763857902490836992,4040,False,en,Thu Aug 11 22:01:30 +0000 2016,@oreillyfactor tonight pm enjoy
1388,False,This is no surprise. Constant phony reporting from failing @CNN turns everyone off. The American people get it! https://t.co/a1A6XMfYx1,False,763740672012738561,29926,iphone,False,763740672012738561,10877,False,en,Thu Aug 11 14:15:40 +0000 2016,surprise constant phony reporting failing @cnn turns everyone american people get
1389,False,"Thank you Fort Lauderdale, Florida. 
#MakeAmericaGreatAgain https://t.co/cjivzdRpU1",False,763558559833591809,22322,iphone,False,763558559833591809,6937,False,en,Thu Aug 11 02:12:01 +0000 2016,thank fort lauderdale florida makeamericagreatagain
1390,False,Great job today by the NYPD in protecting the people and saving the climber.,False,763557327295438848,33299,iphone,False,763557327295438848,8235,False,en,Thu Aug 11 02:07:07 +0000 2016,great job today nypd protecting people saving climber
1391,False,Reuters just announced that Secret Service never spoke to me or my campaign. Made up story by @CNN is a hoax. Totally dishonest.,False,763519861406531584,45090,iphone,False,763519861406531584,20679,False,en,Wed Aug 10 23:38:15 +0000 2016,reuters announced secret service never spoke campaign made story @cnn hoax totally dishonest
1392,False,"""@DSF2020: Really admire your determination: Working so hard for all Americans n daily having to defend yourself from a biased Media.""",False,763519444576370688,20281,android,False,763519444576370688,5801,False,en,Wed Aug 10 23:36:35 +0000 2016,@dsf really admire determination working hard americans n daily defend biased media
1393,False,#MakeAmericaGreatAgain! https://t.co/8rWz6p1Ged,False,763516489865523200,21985,iphone,False,763516489865523200,8834,False,und,Wed Aug 10 23:24:51 +0000 2016,makeamericagreatagain
1394,False,"Thank you Abingdon, Virginia! 
#MakeAmericaGreatAgain 
https://t.co/g7ivluiyF2 https://t.co/RQUKD6sjno",False,763481802254249984,15286,iphone,False,763481802254249984,4980,False,en,Wed Aug 10 21:07:01 +0000 2016,thank abingdon virginia makeamericagreatagain
1395,False,"No such meeting or conversation ever happened - a made up story by ""low ratings"" @CNN.",False,763477408909500416,20477,iphone,False,763477408909500416,7116,False,en,Wed Aug 10 20:49:33 +0000 2016,meeting conversation ever happened made story low ratings @cnn
1396,False,"Great meeting w/ coal miners &amp; leaders from the Virginia coal industry- thank you! #MAGA
https://t.co/wnpVlq6oe4 https://t.co/32gdX684ew",False,763474491183816704,21279,iphone,False,763474491183816704,7436,False,en,Wed Aug 10 20:37:58 +0000 2016,great meeting w coal miners amp leaders virginia coal industry thank maga
1397,False,I will be interviewed on @greta tonight at 7pm. Enjoy! https://t.co/9yicUxd87D,False,763433452893011969,17601,iphone,False,763433452893011969,5285,False,en,Wed Aug 10 17:54:53 +0000 2016,interviewed @greta tonight pm enjoy
1398,False,"My thoughts and prayers are with the two police officers shot in Sebastian County, Arkansas. #LESM",False,763430568721784833,31607,iphone,False,763430568721784833,10663,False,en,Wed Aug 10 17:43:26 +0000 2016,thoughts prayers two police officers shot sebastian county arkansas lesm
1399,False,Morning Joe's weakness is its low ratings. I don't watch anymore but I heard he went wild against Rudy Giuliani and #2A - sad &amp; irrelevant!,False,763398630812311552,21321,iphone,False,763398630812311552,6643,False,en,Wed Aug 10 15:36:31 +0000 2016,morning joe weakness low ratings watch anymore heard went wild rudy giuliani sad amp irrelevant
1400,False,.@dbongino  You were fantastic in defending both the Second Amendment and me last night on @CNN. Don Lemon is a lightweight - dumb as a rock,False,763391459110313984,29048,android,False,763391459110313984,9522,False,en,Wed Aug 10 15:08:01 +0000 2016,@dbongino fantastic defending second amendment last night @cnn lemon lightweight dumb rock
1401,False,Media desperate to distract from Clinton's anti-2A stance. I said pro-2A citizens must organize and get out vote to save our Constitution!,False,763198483927011329,37522,iphone,False,763198483927011329,14882,False,en,Wed Aug 10 02:21:12 +0000 2016,media desperate distract clinton anti stance said pro citizens must organize get vote save constitution
1402,False,"When is the media going to talk about Hillary's policies that have gotten people killed, like Libya, open borders, and maybe her emails?",False,763180978588221440,51121,web,False,763180978588221440,20574,False,en,Wed Aug 10 01:11:39 +0000 2016,media going talk hillary policies gotten people killed like libya open borders maybe emails
1403,False,"Thank you Senator @ChuckGrassley! #TrumpPence16
https://t.co/YmdH3fcaeW",False,763167671974232064,18713,web,False,763167671974232064,6789,False,en,Wed Aug 10 00:18:46 +0000 2016,thank senator @chuckgrassley trumppence
1404,False,"Thank you @SenatorFischer! #TrumpPence16
https://t.co/RMtU6aRZTQ",False,763167345405784064,12183,web,False,763167345405784064,3500,False,en,Wed Aug 10 00:17:28 +0000 2016,thank @senatorfischer trumppence
1405,False,"Thank you Wilmington, North Carolina!
#MakeAmericaGreatAgain https://t.co/ZnnaSPF5or",False,763119571309998083,25592,web,False,763119571309998083,7794,False,en,Tue Aug 09 21:07:38 +0000 2016,thank wilmington north carolina makeamericagreatagain
1406,False,RT @NRA: But there IS something we will do on #ElectionDay: Show up and vote for the #2A! #DefendtheSecond #NeverHillary,False,763115058058629120,0,web,False,763115058058629120,7376,False,en,Tue Aug 09 20:49:42 +0000 2016,rt @nra something electionday show vote defendthesecond neverhillary
1407,False,RT @Carl_C_Icahn: 1/2   Believe Trump gave a great speech.,False,763106383092977664,0,iphone,False,763106383092977664,3403,False,en,Tue Aug 09 20:15:14 +0000 2016,rt @carl c icahn believe trump gave great speech
1408,False,"""@LinHen23:  @foxandfriends Loved Trump's answers to voters questions this morning! Trump's economic plan will help #MAGA #NeverHillary""",False,762982360853905408,17700,android,False,762982360853905408,5478,False,en,Tue Aug 09 12:02:25 +0000 2016,@linhen @foxandfriends loved trump answers voters questions morning trump economic plan help maga neverhillary
1409,False,"""@sprts08: @realDonaldTrump @foxandfriends great interview.....all solid points on our economy TRUMP2016""",False,762982142783676416,13761,android,False,762982142783676416,3831,False,en,Tue Aug 09 12:01:33 +0000 2016,@sprts @realdonaldtrump @foxandfriends great interview solid points economy trump
1410,False,"I am running against the Washington insiders, just like I did in the Republican Primaries. These are the people that have made U.S. a mess!",False,762981606755856384,46194,android,False,762981606755856384,16330,False,en,Tue Aug 09 11:59:25 +0000 2016,running washington insiders like republican primaries people made u mess
1411,False,Will be interviewed on @foxandfriends now!,False,762974889275953152,11366,android,False,762974889275953152,2180,False,en,Tue Aug 09 11:32:43 +0000 2016,interviewed @foxandfriends
1412,False,Being in Detroit today was wonderful. Quick stop in Ohio to meet with some of our great supporters. Just got back home!,False,762842126900015105,25421,android,False,762842126900015105,5674,False,en,Tue Aug 09 02:45:10 +0000 2016,detroit today wonderful quick stop ohio meet great supporters got back home
1413,False,"'As Senator Clinton promised 200,000 jobs in Upstate New York - her efforts fell flat.' https://t.co/I2WqZb5N8P https://t.co/i5S3mtJWpe",False,762790167732035585,17247,iphone,False,762790167732035585,7818,False,en,Mon Aug 08 23:18:42 +0000 2016,senator clinton promised jobs upstate new york efforts fell flat
1414,False,Many people are saying that the Iranians killed the scientist who helped the U.S. because of Hillary Clinton's hacked emails.,False,762781826549030912,33221,iphone,False,762781826549030912,13133,False,en,Mon Aug 08 22:45:33 +0000 2016,many people saying iranians killed scientist helped u hillary clinton hacked emails
1415,False,Thank you Newt!  https://t.co/Acg0hMvrpr,True,762781418778791936,24922,iphone,False,762781418778791936,8864,False,en,Mon Aug 08 22:43:56 +0000 2016,thank newt
1416,False,Thank you Congressman Steven Palazzo! https://t.co/R5Z4CGfjqJ https://t.co/XGSIJJQiGJ,False,762777166476025856,16342,iphone,False,762777166476025856,6055,False,en,Mon Aug 08 22:27:02 +0000 2016,thank congressman steven palazzo
1417,False,"Thank you Senator David Perdue!
https://t.co/d0dCUZ20jf https://t.co/LmfiGByFPb",False,762776440681095169,15368,iphone,False,762776440681095169,6093,False,en,Mon Aug 08 22:24:09 +0000 2016,thank senator david perdue
1418,False,"Thank you @RepLouBarletta!
https://t.co/bre8u93vac https://t.co/eKtSXUw51R",False,762775525756514304,13424,iphone,False,762775525756514304,4625,False,en,Mon Aug 08 22:20:31 +0000 2016,thank @reploubarletta
