,truncated,text,is_quote_status,id,favorite_count,source,retweeted,id_str,retweet_count,favorited,lang,created_at,clean_text
0,False,"Despite what you hear in the press, healthcare is coming along great. We are talking to many groups and it will end in a beautiful picture!",False,839883804315684864,36054,iphone,False,839883804315684864,6936,False,en,Thu Mar 09 17:01:17 +0000 2017,despite hear press healthcare coming along great talking many groups end beautiful picture
1,False,RT @foxnation: .@realDonaldTrump's First Full Month in Office Sees Biggest Jobs Gain 'In Years': Report: https://t.co/rx4bgI1MWK,False,839826581354921984,0,iphone,False,839826581354921984,6768,False,en,Thu Mar 09 13:13:54 +0000 2017,rt @foxnation @realdonaldtrump first full month office sees biggest jobs gain years report
2,False,"Great news. We are only just beginning. Together, we are going to #MAGA! https://t.co/BSp685Q9Qf https://t.co/K7yeBZsf6r",False,839625347524096000,71451,iphone,False,839625347524096000,17721,False,en,Wed Mar 08 23:54:16 +0000 2017,great news beginning together going maga
3,False,Met with @RepCummings today at the @WhiteHouse. Great discussion!,False,839624377826230272,43463,iphone,False,839624377826230272,6607,False,en,Wed Mar 08 23:50:25 +0000 2017,met @repcummings today @whitehouse great discussion
4,False,LinkedIn Workforce Report: January and February were the strongest consecutive months for hiring since August and September 2015,False,839448469374894080,75425,android,False,839448469374894080,14614,False,en,Wed Mar 08 12:11:25 +0000 2017,linkedin workforce report january february strongest consecutive months hiring since august september
5,False,"On International Women's Day, join me in honoring the critical role of women here in America &amp; around the world.",False,839433951957696513,104823,iphone,False,839433951957696513,20792,False,en,Wed Mar 08 11:13:44 +0000 2017,international women day join honoring critical role women america amp around world
6,False,I have tremendous respect for women and the many roles they serve that are vital to the fabric of our society and our economy.,False,839433678275153921,107725,iphone,False,839433678275153921,21583,False,en,Wed Mar 08 11:12:39 +0000 2017,tremendous respect women many roles serve vital fabric society economy
7,False,I feel sure that my friend @RandPaul will come along with the new and great health care program because he knows Obamacare is a disaster!,False,839268048313929729,75477,iphone,False,839268048313929729,14637,False,en,Wed Mar 08 00:14:30 +0000 2017,feel sure friend @randpaul come along new great health care program knows obamacare disaster
8,False,"Don't let the FAKE NEWS tell you that there is big infighting in the Trump Admin. We are getting along great, and getting major things done!",False,839116941956640768,115281,android,False,839116941956640768,24975,False,en,Tue Mar 07 14:14:03 +0000 2017,let fake news tell big infighting trump admin getting along great getting major things done
9,False,I am working on a new system where there will be competition in the Drug Industry. Pricing for the American people will come way down!,False,839110000870109184,117107,android,False,839110000870109184,22899,False,en,Tue Mar 07 13:46:28 +0000 2017,working new system competition drug industry pricing american people come way
10,False,"Don't worry, getting rid of state lines, which will promote competition, will be in phase 2 &amp; 3 of healthcare rollout. @foxandfriends",False,839108868584124417,77881,android,False,839108868584124417,15880,False,en,Tue Mar 07 13:41:58 +0000 2017,worry getting rid state lines promote competition phase amp healthcare rollout @foxandfriends
11,False,"For eight years Russia ""ran over"" President Obama, got stronger and stronger, picked-off Crimea and added missiles. Weak! @foxandfriends",False,839101660886614016,74576,android,False,839101660886614016,16742,False,en,Tue Mar 07 13:13:20 +0000 2017,eight years russia ran president obama got stronger stronger picked crimea added missiles weak @foxandfriends
12,False,Our wonderful new Healthcare Bill is now out for review and negotiation. ObamaCare is a complete and total disaster - is imploding fast!,False,839086723552411648,77690,android,False,839086723552411648,14740,False,en,Tue Mar 07 12:13:59 +0000 2017,wonderful new healthcare bill review negotiation obamacare complete total disaster imploding fast
13,False,"122 vicious prisoners, released by the Obama Administration from Gitmo, have returned to the battlefield. Just another terrible decision!",False,839084268991229952,88010,android,False,839084268991229952,22013,False,en,Tue Mar 07 12:04:13 +0000 2017,vicious prisoners released obama administration gitmo returned battlefield another terrible decision
14,False,"Thank you to @exxonmobil for your $20 billion investment that is creating more than 45,000 manufacturing &amp; construction jobs in the USA!",False,838960097674002432,95918,iphone,False,838960097674002432,18951,False,en,Tue Mar 07 03:50:49 +0000 2017,thank @exxonmobil billion investment creating manufacturing amp construction jobs usa
15,False,"Buy American &amp; hire American are the principles at the core of my agenda, which is: JOBS, JOBS, JOBS! Thank you @exxonmobil.",False,838959869772328960,83714,iphone,False,838959869772328960,15761,False,en,Tue Mar 07 03:49:54 +0000 2017,buy american amp hire american principles core agenda jobs jobs jobs thank @exxonmobil
16,False,"45,000 construction &amp; manufacturing jobs in the U.S. Gulf Coast region. $20 billion investment. We are already winning again, America!",False,838862312685637640,114094,iphone,False,838862312685637640,24352,False,en,Mon Mar 06 21:22:15 +0000 2017,construction amp manufacturing jobs u gulf coast region billion investment already winning america
17,False,"'President Trump Congratulates Exxon Mobil for Job-Creating Investment Program'
https://t.co/adBzWhtq8S",False,838861512999649286,68889,iphone,False,838861512999649286,12673,False,en,Mon Mar 06 21:19:04 +0000 2017,president trump congratulates exxon mobil job creating investment program
18,False,Thank you for the great rallies all across the country. Tremendous support. Make America Great Again!,False,838441522546769923,172336,iphone,False,838441522546769923,30850,False,en,Sun Mar 05 17:30:11 +0000 2017,thank great rallies across country tremendous support make america great
19,False,"Who was it that secretly said to Russian President, ""Tell Vladimir that after the election I'll have more flexibility?"" @foxandfriends",False,838353481526312961,125707,android,False,838353481526312961,36290,False,en,Sun Mar 05 11:40:20 +0000 2017,secretly said russian president tell vladimir election flexibility @foxandfriends
20,False,Is it true the DNC would not allow the FBI access to check server or other equipment after learning it was hacked? Can that be possible?,False,838351476401520640,95964,android,False,838351476401520640,24406,False,en,Sun Mar 05 11:32:22 +0000 2017,true dnc would allow fbi access check server equipment learning hacked possible
21,False,"Arnold Schwarzenegger isn't voluntarily leaving the Apprentice, he was fired by his bad (pathetic) ratings, not by me. Sad end to great show",False,838016045222854656,107135,android,False,838016045222854656,23328,False,en,Sat Mar 04 13:19:29 +0000 2017,arnold schwarzenegger voluntarily leaving apprentice fired bad pathetic ratings sad end great show
22,False,How low has President Obama gone to tapp my phones during the very sacred election process. This is Nixon/Watergate. Bad (or sick) guy!,False,837996746236182529,162887,android,False,837996746236182529,52967,False,en,Sat Mar 04 12:02:48 +0000 2017,low president obama gone tapp phones sacred election process nixon watergate bad sick guy
23,False,"I'd bet a good lawyer could make a great case out of the fact that President Obama was tapping my phones in October, just prior to Election!",False,837994257566863360,132013,android,False,837994257566863360,37278,False,en,Sat Mar 04 11:52:54 +0000 2017,bet good lawyer could make great case fact president obama tapping phones october prior election
24,False,"Is it legal for a sitting President to be ""wire tapping"" a race for president prior to an election? Turned down by court earlier. A NEW LOW!",False,837993273679560704,123938,android,False,837993273679560704,36552,False,en,Sat Mar 04 11:49:00 +0000 2017,legal sitting president wire tapping race president prior election turned court earlier new low
25,False,"Just out: The same Russian Ambassador that met Jeff Sessions visited the Obama White House 22 times, and 4 times last year alone.",False,837991759045079040,121396,android,False,837991759045079040,37586,False,en,Sat Mar 04 11:42:59 +0000 2017,russian ambassador met jeff sessions visited obama white house times times last year alone
26,False,"Terrible! Just found out that Obama had my ""wires tapped"" in Trump Tower just before the victory. Nothing found. This is McCarthyism!",False,837989835818287106,143880,android,False,837989835818287106,50641,False,en,Sat Mar 04 11:35:20 +0000 2017,terrible found obama wires tapped trump tower victory nothing found mccarthyism
27,False,The first meeting Jeff Sessions had with the Russian Amb was set up by the Obama Administration under education program for 100 Ambs......,False,837987684660412416,88320,android,False,837987684660412416,24571,False,en,Sat Mar 04 11:26:47 +0000 2017,first meeting jeff sessions russian amb set obama administration education program ambs
28,False,MAKE AMERICA GREAT AGAIN! https://t.co/kuQiZDz4rA,False,837787963027144706,121879,iphone,False,837787963027144706,34948,False,en,Fri Mar 03 22:13:10 +0000 2017,make america great
29,False,"I hereby demand a second investigation, after Schumer, of Pelosi for her close ties to Russia, and lying about it. https://t.co/qCDljfF3wN",False,837770149767827456,122363,iphone,False,837770149767827456,39952,False,en,Fri Mar 03 21:02:23 +0000 2017,hereby demand second investigation schumer pelosi close ties russia lying
30,False,We must fix our education system for our kids to Make America Great Again. Wonderful day at Saint Andrew in Orlando. https://t.co/OTJaHcvLzf,False,837766616603586560,83065,iphone,False,837766616603586560,16449,False,en,Fri Mar 03 20:48:21 +0000 2017,must fix education system kids make america great wonderful day saint andrew orlando
31,False,We should start an immediate investigation into @SenSchumer and his ties to Russia and Putin. A total hypocrite! https://t.co/Ik3yqjHzsA,False,837722869106880517,150700,iphone,False,837722869106880517,54346,False,en,Fri Mar 03 17:54:30 +0000 2017,start immediate investigation @senschumer ties russia putin total hypocrite
32,False,"Weekly Address
Join me here: https://t.co/SEavQK5zy5 https://t.co/EnyXYeqgcp",False,837704599704375296,53996,iphone,False,837704599704375296,10159,False,en,Fri Mar 03 16:41:55 +0000 2017,weekly address join
33,False,It is so pathetic that the Dems have still not approved my full Cabinet.,False,837638488656920576,137935,android,False,837638488656920576,28093,False,en,Fri Mar 03 12:19:12 +0000 2017,pathetic dems still approved full cabinet
34,False,"Nick Adams new book, Green Card Warrior, is a must read. The merit-based system is the way to go. Canada, Australia! @foxandfriends",False,837633820417482754,66847,android,False,837633820417482754,13852,False,en,Fri Mar 03 12:00:39 +0000 2017,nick adams new book green card warrior must read merit based system way go canada australia @foxandfriends
35,False,"...is all of the illegal leaks of classified and other information. It is a total ""witch hunt!""",False,837492425283219458,94043,android,False,837492425283219458,18253,False,en,Fri Mar 03 02:38:48 +0000 2017,illegal leaks classified information total witch hunt
36,False,"...to win. The Democrats are overplaying their hand. They lost the election, and now they have lost their grip on reality. The real story...",False,837491607171629057,110764,android,False,837491607171629057,23427,False,en,Fri Mar 03 02:35:33 +0000 2017,win democrats overplaying hand lost election lost grip reality real story
37,False,...intentional. This whole narrative is a way of saving face for Democrats losing an election that everyone thought they were supposed.....,False,837489578193846278,91124,android,False,837489578193846278,17656,False,en,Fri Mar 03 02:27:29 +0000 2017,intentional whole narrative way saving face democrats losing election everyone thought supposed
38,False,"Jeff Sessions is an honest man. He did not say anything wrong. He could have stated his response more accurately, but it was clearly not....",False,837488402438176769,103260,android,False,837488402438176769,19995,False,en,Fri Mar 03 02:22:49 +0000 2017,jeff sessions honest man say anything wrong could stated response accurately clearly
39,False,"Since November 8th, Election Day, the Stock Market has posted $3.2 trillion in GAINS and consumer confidence is at a 15 year high. Jobs!",False,837256338203881472,176949,android,False,837256338203881472,37416,False,en,Thu Mar 02 11:00:41 +0000 2017,since november th election day stock market posted trillion gains consumer confidence year high jobs
40,False,THANK YOU!,False,836933725602656256,186375,android,False,836933725602656256,27787,False,en,Wed Mar 01 13:38:44 +0000 2017,thank
41,False,"Join me live at 9:00 P.M. 
#JointAddress https://t.co/J882zbyVkJ https://t.co/gTtK3vJmkU",False,836750538943377408,55209,iphone,False,836750538943377408,7419,False,en,Wed Mar 01 01:30:49 +0000 2017,join live p jointaddress
42,False,I will be interviewed on @foxandfriends at 6:00 A.M. Enjoy!,False,836406328369242113,83756,android,False,836406328369242113,11115,False,en,Tue Feb 28 02:43:03 +0000 2017,interviewed @foxandfriends enjoy
43,False,"GOP now viewed more favorably than Dems, in Trump era (per NBC/WSJ poll) via @HotlineJosh:
https://t.co/Soebxtg2Zd",False,836332166728527872,71345,iphone,False,836332166728527872,14778,False,en,Mon Feb 27 21:48:21 +0000 2017,gop viewed favorably dems trump era per nbc wsj poll via @hotlinejosh
44,False,"Big dinner with Governors tonight at White House. Much to be discussed, including healthcare.",False,835946001873657858,107403,android,False,835946001873657858,15921,False,en,Sun Feb 26 20:13:52 +0000 2017,big dinner governors tonight white house much discussed including healthcare
45,False,"Russia talk is FAKE NEWS put out by the Dems, and played up by the media, in order to mask the big election defeat and the illegal leaks!",False,835916511944523777,114797,android,False,835916511944523777,24907,False,en,Sun Feb 26 18:16:41 +0000 2017,russia talk fake news put dems played media order mask big election defeat illegal leaks
46,False,For first time the failing @nytimes will take an ad (a bad one) to help save its failing reputation. Try reporting accurately &amp; fairly!,False,835817351178301440,111031,android,False,835817351178301440,22083,False,en,Sun Feb 26 11:42:39 +0000 2017,first time failing @nytimes take ad bad one help save failing reputation try reporting accurately amp fairly
47,False,"The race for DNC Chairman was, of course, totally ""rigged."" Bernie's guy, like Bernie himself, never had a chance. Clinton demanded Perez!",False,835814988686233601,88493,android,False,835814988686233601,19351,False,en,Sun Feb 26 11:33:16 +0000 2017,race dnc chairman course totally rigged bernie guy like bernie never chance clinton demanded perez
48,False,"Congratulations to Thomas Perez, who has just been named Chairman of the DNC. I could not be happier for him, or for the Republican Party!",False,835610917568200705,132737,android,False,835610917568200705,29289,False,en,Sat Feb 25 22:02:22 +0000 2017,congratulations thomas perez named chairman dnc could happier republican party
49,False,I will not be attending the White House Correspondents' Association Dinner this year. Please wish everyone well and have a great evening!,False,835608648625836032,125907,android,False,835608648625836032,24251,False,en,Sat Feb 25 21:53:21 +0000 2017,attending white house correspondents association dinner year please wish everyone well great evening
50,False,Weekly Address from @WhiteHouse: https://t.co/uaoQSHBOQB https://t.co/7eF6aC6kEC,False,835553050530099200,46264,iphone,False,835553050530099200,10152,False,en,Sat Feb 25 18:12:25 +0000 2017,weekly address @whitehouse
51,False,"Great optimism for future of U.S. business, AND JOBS, with the DOW having an 11th straight record close. Big tax &amp; regulation cuts coming!",False,835481237879926784,105403,android,False,835481237879926784,20011,False,en,Sat Feb 25 13:27:04 +0000 2017,great optimism future u business jobs dow th straight record close big tax amp regulation cuts coming
52,False,The media has not reported that the National Debt in my first month went down by $12 billion vs a $200 billion increase in Obama first mo.,False,835479283699224576,203264,android,False,835479283699224576,62144,False,en,Sat Feb 25 13:19:18 +0000 2017,media reported national debt first month went billion vs billion increase obama first mo
53,False,Maybe the millions of people who voted to MAKE AMERICA GREAT AGAIN should have their own rally. It would be the biggest of them all!,False,835465719970217984,160826,android,False,835465719970217984,35007,False,en,Sat Feb 25 12:25:24 +0000 2017,maybe millions people voted make america great rally would biggest
54,False,FAKE NEWS media knowingly doesn't tell the truth. A great danger to our country. The failing @nytimes has become a joke. Likewise @CNN. Sad!,False,835325771858251776,110445,android,False,835325771858251776,26664,False,en,Sat Feb 25 03:09:18 +0000 2017,fake news media knowingly tell truth great danger country failing @nytimes become joke likewise @cnn sad
55,False,"Trump vows to fight 'epidemic' of human trafficking 
https://t.co/oDLZ2NdrtA",False,835173525522624512,92058,iphone,False,835173525522624512,20398,False,en,Fri Feb 24 17:04:19 +0000 2017,trump vows fight epidemic human trafficking
56,False,Going to CPAC!,False,835124485632180224,72780,android,False,835124485632180224,9049,False,en,Fri Feb 24 13:49:27 +0000 2017,going cpac
57,False,find the leakers within the FBI itself. Classified information is being given to media that could have a devastating effect on U.S. FIND NOW,False,835106143462703104,101979,android,False,835106143462703104,21915,False,en,Fri Feb 24 12:36:34 +0000 2017,find leakers within fbi classified information given media could devastating effect u find
58,False,"The FBI is totally unable to stop the national security ""leakers"" that have permeated our government for a long time. They can't even......",False,835104946034991106,81366,android,False,835104946034991106,17818,False,en,Fri Feb 24 12:31:49 +0000 2017,fbi totally unable stop national security leakers permeated government long time even
59,False,Big interview tonight by Henry Kravis at The Business Council of Washington. Looking forward to it!,False,834917440450609152,58913,android,False,834917440450609152,8360,False,en,Fri Feb 24 00:06:44 +0000 2017,big interview tonight henry kravis business council washington looking forward
60,False,Seven people shot and killed yesterday in Chicago. What is going on there - totally out of control. Chicago needs help!,False,834916167177371648,109947,android,False,834916167177371648,23534,False,en,Fri Feb 24 00:01:40 +0000 2017,seven people shot killed yesterday chicago going totally control chicago needs help
61,False,'S&amp;P 500 Edges Higher After Trump Renews Jobs Pledge' https://t.co/WtrRJVFmvU,False,834899071982841856,56935,iphone,False,834899071982841856,10689,False,en,Thu Feb 23 22:53:45 +0000 2017,amp p edges higher trump renews jobs pledge
62,False,Very much enjoyed my tour of the Smithsonian's National Museum of African American History and Culture...A great job done by amazing people!,False,834384982495940613,118264,android,False,834384982495940613,16428,False,en,Wed Feb 22 12:50:56 +0000 2017,much enjoyed tour smithsonian national museum african american history culture great job done amazing people
63,False,"One thing I will say about Rep. Keith Ellison, in his fight to lead the DNC, is that he was the one who predicted early that I would win!",False,834377364947816448,80465,android,False,834377364947816448,12306,False,en,Wed Feb 22 12:20:40 +0000 2017,one thing say rep keith ellison fight lead dnc one predicted early would win
64,False,"The so-called angry crowds in home districts of some Republicans are actually, in numerous cases, planned out by liberal activists. Sad!",False,834181712783560705,120152,android,False,834181712783560705,26435,False,en,Tue Feb 21 23:23:13 +0000 2017,called angry crowds home districts republicans actually numerous cases planned liberal activists sad
65,False,'Americans overwhelmingly oppose sanctuary cities' https://t.co/s5QvsJWA6u,False,834142323881684993,108609,iphone,False,834142323881684993,23955,False,en,Tue Feb 21 20:46:42 +0000 2017,americans overwhelmingly oppose sanctuary cities
66,False,"Congratulations to our new National Security Advisor, General H.R. McMaster. Video: https://t.co/BKn9r225Kk https://t.co/VBXcJ1b6Pv",False,833838311315763200,95384,iphone,False,833838311315763200,16215,False,en,Tue Feb 21 00:38:40 +0000 2017,congratulations new national security advisor general h r mcmaster video
67,False,Just named General H.R. McMaster National Security Advisor.,False,833783438922629125,107943,android,False,833783438922629125,16008,False,en,Mon Feb 20 21:00:37 +0000 2017,named general h r mcmaster national security advisor
68,False,HAPPY PRESIDENTS DAY - MAKE AMERICA GREAT AGAIN!,False,833686030679207936,246204,android,False,833686030679207936,49757,False,en,Mon Feb 20 14:33:33 +0000 2017,happy presidents day make america great
69,False,Give the public a break - The FAKE NEWS media is trying to say that large scale immigration in Sweden is working out just beautifully. NOT!,False,833681539997253636,143597,android,False,833681539997253636,35526,False,en,Mon Feb 20 14:15:42 +0000 2017,give public break fake news media trying say large scale immigration sweden working beautifully
70,False,My statement as to what's happening in Sweden was in reference to a story that was broadcast on @FoxNews concerning immigrants &amp; Sweden.,False,833435244451753984,114192,android,False,833435244451753984,26653,False,en,Sun Feb 19 21:57:01 +0000 2017,statement happening sweden reference story broadcast @foxnews concerning immigrants amp sweden
71,False,"Will be having many meetings this weekend at The Southern White House. Big 5:00 P.M. speech in Melbourne, Florida. A lot to talk about!",False,832950628750127106,100880,android,False,832950628750127106,15501,False,en,Sat Feb 18 13:51:20 +0000 2017,many meetings weekend southern white house big p speech melbourne florida lot talk
72,False,Don't believe the main stream (fake news) media.The White House is running VERY WELL. I inherited a MESS and am in the process of fixing it.,False,832945737625387008,189101,android,False,832945737625387008,39660,False,en,Sat Feb 18 13:31:53 +0000 2017,believe main stream fake news media white house running well inherited mess process fixing
73,False,Looking forward to the Florida rally tomorrow. Big crowd expected!,False,832742165436579840,100660,android,False,832742165436579840,14385,False,en,Sat Feb 18 00:02:58 +0000 2017,looking forward florida rally tomorrow big crowd expected
74,False,"""One of the most effective press conferences I've ever seen!"" says Rush Limbaugh. Many agree.Yet FAKE MEDIA  calls it differently! Dishonest",False,832730328108134402,122237,android,False,832730328108134402,22082,False,en,Fri Feb 17 23:15:56 +0000 2017,one effective press conferences ever seen says rush limbaugh many agree yet fake media calls differently dishonest
75,False,"The FAKE NEWS media (failing @nytimes, @NBCNews, @ABC, @CBS, @CNN) is not my enemy, it is the enemy of the American People!",False,832708293516632065,162739,android,False,832708293516632065,51237,False,en,Fri Feb 17 21:48:22 +0000 2017,fake news media failing @nytimes @nbcnews @abc @cbs @cnn enemy enemy american people
76,False,"Join me at 11:00am:
Watch here: https://t.co/veqKmsGAwf https://t.co/UzndIjIqjM",False,832614137586933760,57431,iphone,False,832614137586933760,10065,False,en,Fri Feb 17 15:34:14 +0000 2017,join watch
77,False,"General Keith Kellogg, who I have known for a long time, is very much in play for NSA - as are three others.",False,832579442790772736,70764,iphone,False,832579442790772736,11145,False,en,Fri Feb 17 13:16:22 +0000 2017,general keith kellogg known long time much play nsa three others
78,False,Thank you for all of the nice statements on the Press Conference yesterday. Rush Limbaugh said one of greatest ever. Fake media not happy!,False,832555987299082242,153229,android,False,832555987299082242,26793,False,en,Fri Feb 17 11:43:10 +0000 2017,thank nice statements press conference yesterday rush limbaugh said one greatest ever fake media happy
79,False,"Going to Charleston, South Carolina, in order to spend time with Boeing and talk jobs! Look forward to it.",False,832554772318322688,100584,android,False,832554772318322688,14538,False,en,Fri Feb 17 11:38:20 +0000 2017,going charleston south carolina order spend time boeing talk jobs look forward
80,False,"Despite the long delays by the Democrats in finally approving Dr. Tom Price, the repeal and replacement of ObamaCare is moving fast!",False,832533430168608768,104473,android,False,832533430168608768,17443,False,en,Fri Feb 17 10:13:32 +0000 2017,despite long delays democrats finally approving dr tom price repeal replacement obamacare moving fast
81,False,'Trump signs bill undoing Obama coal mining rule' https://t.co/yMfT5r5RGh,False,832375230274400256,95138,iphone,False,832375230274400256,18984,False,en,Thu Feb 16 23:44:54 +0000 2017,trump signs bill undoing obama coal mining rule
