,truncated,text,is_quote_status,id,favorite_count,source,retweeted,id_str,retweet_count,favorited,lang,created_at,clean_text
2091,False,"Rally last night in San Jose was great. Tremendous love and enthusiasm in the hall. Big crowd. Outside, small group of thugs burned Am flag!",False,738712803775631361,15696,android,False,738712803775631361,5225,False,en,Fri Jun 03 12:43:51 +0000 2016,rally last night san jose great tremendous love enthusiasm hall big crowd outside small group thugs burned flag
2092,False,"Terrible jobs report just reported. Only 38,000 jobs added. Bombshell!",False,738711092252155904,11756,android,False,738711092252155904,4617,False,en,Fri Jun 03 12:37:03 +0000 2016,terrible jobs report reported jobs added bombshell
2093,False,"""@fivestarr6028: Yes! Hubby and I voted 4 @realDonaldTrump already! https://t.co/h1iHiJNUjm"" Thank you.",True,738602229100224513,5843,android,False,738602229100224513,1781,False,en,Fri Jun 03 05:24:28 +0000 2016,@fivestarr yes hubby voted @realdonaldtrump already thank
2094,False,"""@LiliannyLeebou: I think the first female president of the USA will be @IvankaTrump a beautiful intelligent young genuine successful lady!""",False,738601935771570180,11013,android,False,738601935771570180,3081,False,en,Fri Jun 03 05:23:18 +0000 2016,@liliannyleebou think first female president usa @ivankatrump beautiful intelligent young genuine successful lady
2095,False,"""@LunsfordWhitney: This is rich coming from her. She tweeted you will be president! #Women4Ttump #Trump2016 https://t.co/2GSGfLS1yT""",True,738600538976096256,8033,android,False,738600538976096256,3099,False,en,Fri Jun 03 05:17:45 +0000 2016,@lunsfordwhitney rich coming tweeted president women ttump trump
2096,False,"""@angeloftruth11: Clinton says Trump is dangerous. Who's the one who killed 4 Americans in Benghazi?  https://t.co/ZV5ehm6NKR""",False,738599744759431168,12096,android,False,738599744759431168,5691,False,en,Fri Jun 03 05:14:36 +0000 2016,@angeloftruth clinton says trump dangerous one killed americans benghazi
2097,False,"""@Crz4basball: @JudgeJeanine  @realDonaldTrump Looks like several legal Hispanics supporting Trump! They know he will be good for them too.""",False,738598954468659200,8091,android,False,738598954468659200,2443,False,en,Fri Jun 03 05:11:27 +0000 2016,@crz basball @judgejeanine @realdonaldtrump looks like several legal hispanics supporting trump know good
2098,False,"Then, on June 25th- back to the USA to MAKE AMERICA GREAT AGAIN!",False,738576654176387072,9196,iphone,False,738576654176387072,2428,False,en,Fri Jun 03 03:42:51 +0000 2016,june th back usa make america great
2099,False,"After @TrumpScotland, I will visit @TrumpDoonbeg in Ireland, the magnificent resort fronting on the Atlantic Ocean.",False,738576553508929536,7584,iphone,False,738576553508929536,1991,False,en,Fri Jun 03 03:42:27 +0000 2016,@trumpscotland visit @trumpdoonbeg ireland magnificent resort fronting atlantic ocean
2100,False,"After @TrumpTurnberry I will be visiting Aberdeen, the oil capital of Europe, to see my great club, @TrumpScotland.",False,738576209726955524,6972,iphone,False,738576209726955524,1794,False,en,Fri Jun 03 03:41:05 +0000 2016,@trumpturnberry visiting aberdeen oil capital europe see great club @trumpscotland
2101,False,"On June 22- I will be going to Scotland to celebrate the opening of the newly renovated @TrumpTurnberry Resort, the worlds best.",False,738575853261574144,8636,iphone,False,738575853261574144,2195,False,en,Fri Jun 03 03:39:40 +0000 2016,june going scotland celebrate opening newly renovated @trumpturnberry resort worlds best
2102,False,"Join me in Redding, California- tomorrow at 1:00pm. #Trump2016
Tickets: https://t.co/tyllhxJHC7",False,738575670771486721,5825,iphone,False,738575670771486721,1872,False,en,Fri Jun 03 03:38:56 +0000 2016,join redding california tomorrow pm trump tickets
2103,False,".@Natalie_Gulbis- Thank you for the nice piece in @SInow / @Golf_com.
Keep up the great work! https://t.co/JCZPCFx10X",False,738539023669465094,6345,iphone,False,738539023669465094,1822,False,en,Fri Jun 03 01:13:19 +0000 2016,@natalie gulbis thank nice piece @sinow @golf com keep great work
2104,False,"""@RobertMordica: @realDonaldTrump Only Trump can save America. Right leader at the right time."" THANK YOU!",False,738496464448430080,9100,android,False,738496464448430080,2596,False,en,Thu Jun 02 22:24:12 +0000 2016,@robertmordica @realdonaldtrump trump save america right leader right time thank
2105,False,"""@Valenti317: @realDonaldTrump she's a criminal and you're the only person that can stop her.""",False,738495995583987712,8455,android,False,738495995583987712,2471,False,en,Thu Jun 02 22:22:20 +0000 2016,@valenti @realdonaldtrump criminal person stop
2106,False,"""@TaylorEdwards99: THIS IS @POTUS'S LEGACY! AN ABSOLUTE DISASTER!!! WE NEED @realDonaldTrump NOW!! #MAGA #TRUMP2016 https://t.co/lBgZJg0zd1",False,738495529005420544,13413,android,False,738495529005420544,6770,False,en,Thu Jun 02 22:20:29 +0000 2016,@tayloredwards @potus legacy absolute disaster need @realdonaldtrump maga trump
2107,False,"""@free_SA_BD: @realDonaldTrump A vote for Trump is a vote to restore our great country.""",False,738495114532638720,8909,android,False,738495114532638720,2751,False,en,Thu Jun 02 22:18:50 +0000 2016,@free sa bd @realdonaldtrump vote trump vote restore great country
2108,False,"A 60% increase in Texas Blue Cross/Blue Shield through ObamaCare. I told you so, there is panic and anger as healthcare costs explode!",False,738494609597157376,13460,android,False,738494609597157376,5411,False,en,Thu Jun 02 22:16:50 +0000 2016,increase texas blue cross blue shield obamacare told panic anger healthcare costs explode
2109,False,So great to have the endorsement and support of Paul Ryan. We will both be working very hard to Make America Great Again!,False,738478522813972480,22334,iphone,False,738478522813972480,6801,False,en,Thu Jun 02 21:12:54 +0000 2016,great endorsement support paul ryan working hard make america great
2110,False,Bad performance by Crooked Hillary Clinton! Reading poorly from the telepromter! She doesn't even look presidential!,False,738449664752553984,23644,android,False,738449664752553984,7716,False,en,Thu Jun 02 19:18:14 +0000 2016,bad performance crooked hillary clinton reading poorly telepromter even look presidential
2111,False,Crooked Hillary no longer has credibility - too much failure in office. People will not allow another four years of incompetence!,False,738448988517453824,20520,android,False,738448988517453824,6761,False,en,Thu Jun 02 19:15:33 +0000 2016,crooked hillary longer credibility much failure office people allow another four years incompetence
2112,False,"Crooked Hillary Clinton, who I would love to call Lyin' Hillary, is getting ready to totally misrepresent my foreign policy positions.",False,738416510092357632,15411,android,False,738416510092357632,5185,False,en,Thu Jun 02 17:06:29 +0000 2016,crooked hillary clinton would love call lyin hillary getting ready totally misrepresent foreign policy positions
2113,False,"After the litigation is disposed of and the case won, I have instructed my execs to open Trump U(?), so much interest in it! I will be pres.",False,738415541203832832,10013,android,False,738415541203832832,2921,False,en,Thu Jun 02 17:02:38 +0000 2016,litigation disposed case instructed execs open trump u much interest pres
2114,False,"Even though I have a very biased and unfair judge in the Trump U civil case in San Diego, I have thousands of great reviews &amp; will win case!",False,738413456118841345,10890,android,False,738413456118841345,2998,False,en,Thu Jun 02 16:54:21 +0000 2016,even though biased unfair judge trump u civil case san diego thousands great reviews amp win case
2115,False,"With all of the Crooked Hillary Clinton's foreign policy experience, she has made so many mistakes - and I mean real monsters! No more HRC.",False,738412068181676032,11721,android,False,738412068181676032,3979,False,en,Thu Jun 02 16:48:50 +0000 2016,crooked hillary clinton foreign policy experience made many mistakes mean real monsters hrc
2116,False,"Join me in San Jose, California- tonight!
#MakeAmericaGreatAgain #Trump2016
Tickets: https://t.co/jLQukR550J https://t.co/OrEhKJZ5Rd",False,738409191526662144,7032,iphone,False,738409191526662144,2333,False,en,Thu Jun 02 16:37:24 +0000 2016,join san jose california tonight makeamericagreatagain trump tickets
2117,False,"Wow, USA Today did todays cover story on my record in lawsuits. Verdict: 450 wins, 38 losses. Isn't that what you want for your president?",False,738407796606013444,16380,android,False,738407796606013444,5274,False,en,Thu Jun 02 16:31:52 +0000 2016,wow usa today todays cover story record lawsuits verdict wins losses want president
2118,False,Do you ever notice that @CNN gives me very little proper representation on my policies. Just watched-nobody knew anything about my foreign P,False,738399082813620224,11462,android,False,738399082813620224,3631,False,en,Thu Jun 02 15:57:14 +0000 2016,ever notice @cnn gives little proper representation policies watched nobody knew anything foreign p
2119,False,Bernie Sanders was right when he said that Crooked Hillary Clinton was not qualified to be president because she suffers from BAD judgement!,False,738387288372051969,17345,android,False,738387288372051969,5304,False,en,Thu Jun 02 15:10:22 +0000 2016,bernie sanders right said crooked hillary clinton qualified president suffers bad judgement
2120,False,Crooked Hillary Clinton has zero natural talent - she should not be president. Her temperament is bad and her decision making ability-zilch!,False,738385522301624323,15778,android,False,738385522301624323,5235,False,en,Thu Jun 02 15:03:21 +0000 2016,crooked hillary clinton zero natural talent president temperament bad decision making ability zilch
2121,False,"""@HaloDad22: @realDonaldTrump I already voted for you! My wife did as well! I represent #Teachers4Trump! We represent #CA4Trump! #NeverDems",False,738236891091238913,9057,android,False,738236891091238913,2525,False,en,Thu Jun 02 05:12:45 +0000 2016,@halodad @realdonaldtrump already voted wife well represent teachers trump represent ca trump neverdems
2122,False,"""@SCPioneer: @stockdaleism @JamesRosenFNC @FoxNews @realDonaldTrump Not for slackers! Happy w/courses I took."" Thanks.",False,738236517949181952,6772,android,False,738236517949181952,1923,False,en,Thu Jun 02 05:11:16 +0000 2016,@scpioneer @stockdaleism @jamesrosenfnc @foxnews @realdonaldtrump slackers happy w courses took thanks
2123,False,"Thank you Sacramento, California! #MakeAmericaGreatAgain https://t.co/t75Zxn9L6f",False,738233323344920576,16226,iphone,False,738233323344920576,5087,False,en,Thu Jun 02 04:58:34 +0000 2016,thank sacramento california makeamericagreatagain
2124,False,"Same failing @nytimes ""reporter"" who wrote discredited women's story last week wrote another terrible story on me today- will never learn!",False,738163472865759232,12885,iphone,False,738163472865759232,3975,False,en,Thu Jun 02 00:21:01 +0000 2016,failing @nytimes reporter wrote discredited women story last week wrote another terrible story today never learn
2125,False,Crooked Hillary Clinton is a fraud who has put the public and country at risk by her illegal and very stupid use of e-mails. Many missing!,False,738132164399636480,26806,android,False,738132164399636480,9713,False,en,Wed Jun 01 22:16:36 +0000 2016,crooked hillary clinton fraud put public country risk illegal stupid use e mails many missing
2126,False,"Join me in San Jose, California- tomorrow evening at 7pm! 
#MakeAmericaGreatAgain #Trump2016
https://t.co/jLQukR550J https://t.co/Uds8OdH3A4",False,738109521952833536,9183,iphone,False,738109521952833536,3214,False,en,Wed Jun 01 20:46:38 +0000 2016,join san jose california tomorrow evening pm makeamericagreatagain trump
2127,False,"So I raised/gave $5,600,000 for the veterans and the media makes me look bad! They do anything to belittle - totally biased.",False,737996614573260800,29250,android,False,737996614573260800,9224,False,en,Wed Jun 01 13:17:58 +0000 2016,raised gave veterans media makes look bad anything belittle totally biased
2128,False,Congratulations to @seanhannity on his tremendous increase in television ratings. Speaking of ratings- I will be on his show tonight @ 10pE.,False,737785345459113985,18162,iphone,False,737785345459113985,4968,False,en,Tue May 31 23:18:28 +0000 2016,congratulations @seanhannity tremendous increase television ratings speaking ratings show tonight @ pe
2129,False,I am getting great credit for my press conference today. Crooked Hillary should be admonished for not having a press conference in 179 days.,False,737785114239864832,21207,iphone,False,737785114239864832,7018,False,en,Tue May 31 23:17:33 +0000 2016,getting great credit press conference today crooked hillary admonished press conference days
2130,False,"Katie Couric, the third rate reporter, who has been largely forgotten, should be ashamed of herself for the fraudulent editing of her doc.",False,737784398515441664,20903,iphone,False,737784398515441664,6863,False,en,Tue May 31 23:14:42 +0000 2016,katie couric third rate reporter largely forgotten ashamed fraudulent editing doc
2131,False,I will be interviewed on @seanhannity tonight at 10pmE on @FoxNews. Enjoy!,False,737778668785766404,9078,iphone,False,737778668785766404,2340,False,en,Tue May 31 22:51:56 +0000 2016,interviewed @seanhannity tonight pme @foxnews enjoy
2132,False,"Join me in Sacramento, California-tomorrow evening @ 7pm! #Trump2016
https://t.co/W7xy7eXcii https://t.co/km0rRYSDnO",False,737753549564694528,8802,iphone,False,737753549564694528,3148,False,en,Tue May 31 21:12:07 +0000 2016,join sacramento california tomorrow evening @ pm trump
2133,False,So many veterans groups are beyond happy with all of the money I raised/gave! It was my great honor - they do an amazing job.,False,737689416811073536,19472,android,False,737689416811073536,5493,False,en,Tue May 31 16:57:17 +0000 2016,many veterans groups beyond happy money raised gave great honor amazing job
2134,False,"Just finished a press conference in Trump Tower wherein I gave information on which VETERANS groups got the $5,600,000 that I raised/gave!",False,737688582849171456,18179,android,False,737688582849171456,5377,False,en,Tue May 31 16:53:58 +0000 2016,finished press conference trump tower wherein gave information veterans groups got raised gave
2135,False,"I have raised/given a tremendous amount of money to our great VETERANS, and have got nothing but bad publicity for doing so. Watch!",False,737610159459991552,19630,android,False,737610159459991552,5464,False,en,Tue May 31 11:42:20 +0000 2016,raised given tremendous amount money great veterans got nothing bad publicity watch
2136,False,"So many great things happening - new poll numbers looking good! News conference at 11:00 A.M. today, Trump Tower!",False,737596690257969152,14704,android,False,737596690257969152,3928,False,en,Tue May 31 10:48:49 +0000 2016,many great things happening new poll numbers looking good news conference today trump tower
2137,False,"I should have easily won the Trump University case on summary judgement but have a judge, Gonzalo Curiel, who is totally biased against me.",False,737402123453878272,14566,android,False,737402123453878272,4029,False,en,Mon May 30 21:55:41 +0000 2016,easily trump university case summary judgement judge gonzalo curiel totally biased
2138,False,"I have a judge in the Trump University civil case, Gonzalo Curiel (San Diego), who is very unfair. An Obama pick. Totally biased-hates Trump",False,737399475509985280,13224,android,False,737399475509985280,3787,False,en,Mon May 30 21:45:09 +0000 2016,judge trump university civil case gonzalo curiel san diego unfair obama pick totally biased hates trump
2139,False,I hope everyone had a great Memorial Day!,False,737376803514286081,20887,android,False,737376803514286081,5086,False,en,Mon May 30 20:15:04 +0000 2016,hope everyone great memorial day
2140,False,"I would have had millions of votes more in the primaries (than Crooked Hillary) if I only had one opponent, instead of sixteen. Broke record",False,737376356795875330,18311,android,False,737376356795875330,4909,False,en,Mon May 30 20:13:17 +0000 2016,would millions votes primaries crooked hillary one opponent instead sixteen broke record
2141,False,Have a great Memorial Day and remember that we will soon MAKE AMERICA GREAT AGAIN!,False,737243856144629760,25132,android,False,737243856144629760,8999,False,en,Mon May 30 11:26:47 +0000 2016,great memorial day remember soon make america great
2142,False,"""@NBCDFW: Trump rallies veterans at annual Rolling Thunder Gathering https://t.co/b08FcMlgkr https://t.co/RCDeLvHQqD""",False,737242308261842945,8899,android,False,737242308261842945,2660,False,en,Mon May 30 11:20:38 +0000 2016,@nbcdfw trump rallies veterans annual rolling thunder gathering
2143,False,"""@FrankyLamouche: how many of donald's rolling thunder brigade will sign up and go to war for him in the middle east.""",False,737242189055594496,6471,android,False,737242189055594496,1555,False,en,Mon May 30 11:20:09 +0000 2016,@frankylamouche many donald rolling thunder brigade sign go war middle east
2144,False,"""@MariaErnandez3b: Trump Supports Rolling Thunder Rally #TRUMP STRONG https://t.co/pfVXQ8NdZu"" So true, and remember the M.I.A.'s!",False,737242018687164416,14941,android,False,737242018687164416,4108,False,en,Mon May 30 11:19:29 +0000 2016,@mariaernandez b trump supports rolling thunder rally trump strong true remember
2145,False,"""@ScottWRasmussen: Donald Trump and Bikers Share Affection at Rolling Thunder Rally https://t.co/ZZl2sc29dn"" A great day in D.C.!",False,737241411465170944,6933,android,False,737241411465170944,2100,False,en,Mon May 30 11:17:04 +0000 2016,@scottwrasmussen donald trump bikers share affection rolling thunder rally great day c
2146,False,"""@TeaPartyNevada: #Trump2016 ""Illegals are taken care of better than our veterans.""  https://t.co/KKIgM4rNma https://t.co/1cEZ8wG7Cy""",False,737239685295181824,9431,android,False,737239685295181824,3431,False,en,Mon May 30 11:10:12 +0000 2016,@teapartynevada trump illegals taken care better veterans
2147,False,"The endorsement of me by the 16,500 Border Patrol Agents was the first time that they ever endorsed a presidential candidate. Nice!",False,737238518775320576,20863,android,False,737238518775320576,5478,False,en,Mon May 30 11:05:34 +0000 2016,endorsement border patrol agents first time ever endorsed presidential candidate nice
2148,False,"In getting the endorsement of the 16,500 Border Patrol Agents (thank you), the statement was made that the WALL was very necessary!",False,737237313034563585,14426,android,False,737237313034563585,4152,False,en,Mon May 30 11:00:47 +0000 2016,getting endorsement border patrol agents thank statement made wall necessary
2149,False,Obama says a WALL at our southern border won't enhance our security (wrong) and yet he now wants to build a much bigger wall (fence) at W.H.,False,737232540436664320,17635,android,False,737232540436664320,6340,False,en,Mon May 30 10:41:49 +0000 2016,obama says wall southern border enhance security wrong yet wants build much bigger wall fence w h
2150,False,"If dummy Bill Kristol actually does get a spoiler to run as an Independent, say good bye to the Supreme Court!",False,737056428452630528,15840,iphone,False,737056428452630528,5894,False,en,Sun May 29 23:02:01 +0000 2016,dummy bill kristol actually get spoiler run independent say good bye supreme court
2151,False,The Republican Party has to be smart &amp; strong if it wants to win in November. Can't allow lightweights to set up a spoiler Indie candidate!,False,737055532960223233,20687,android,False,737055532960223233,6053,False,en,Sun May 29 22:58:27 +0000 2016,republican party smart amp strong wants win november allow lightweights set spoiler indie candidate
2152,False,"Bill Kristol has been wrong for 2yrs-an embarrassed loser, but if the GOP can't control their own, then they are not a party. Be tough, R's!",False,737054226833149952,15966,iphone,False,737054226833149952,5016,False,en,Sun May 29 22:53:16 +0000 2016,bill kristol wrong yrs embarrassed loser gop control party tough r
2153,False,Good news is that my campaign has perhaps more cash than any campaign in the history of politics- b/c I stand 100% behind everything we do.,False,737036608915034112,19547,iphone,False,737036608915034112,6015,False,en,Sun May 29 21:43:15 +0000 2016,good news campaign perhaps cash campaign history politics b c stand behind everything
2154,False,Heading to D.C. to see and hear ROLLING THUNDER. Amazing people that LOVE OUR COUNTRY. Great spirit!,False,736961734167146496,17609,android,False,736961734167146496,4710,False,en,Sun May 29 16:45:44 +0000 2016,heading c see hear rolling thunder amazing people love country great spirit
2155,False,Honor Memorial Day by thinking of and respecting all of the great men and women that gave their lives for us and our country! We love them.,False,736875933999697920,39766,android,False,736875933999697920,14708,False,en,Sun May 29 11:04:47 +0000 2016,honor memorial day thinking respecting great men women gave lives us country love
2156,False,Does President Obama ever discuss the sneak attack on Pearl Harbor while he's in Japan? Thousands of American lives lost. #MDW,False,736672123012427776,27039,iphone,False,736672123012427776,10931,False,en,Sat May 28 21:34:55 +0000 2016,president obama ever discuss sneak attack pearl harbor japan thousands american lives lost mdw
2157,False,Don't believe the biased and phony media quoting people who work for my campaign. The only quote that matters is a quote from me!,False,736671884247478272,19591,iphone,False,736671884247478272,7176,False,en,Sat May 28 21:33:58 +0000 2016,believe biased phony media quoting people work campaign quote matters quote
2158,False,"I am always on the front page of the failing @nytimes, but when I won the GOP nomination, I'm in the back of the paper. Very dishonest!",False,736655485814857728,16964,iphone,False,736655485814857728,5199,False,en,Sat May 28 20:28:48 +0000 2016,always front page failing @nytimes gop nomination back paper dishonest
2159,False,The media is on a new phony kick about my management style. I spend much less money &amp; get much better results! What we need as Prez!,False,736655448993107968,19541,iphone,False,736655448993107968,5756,False,en,Sat May 28 20:28:40 +0000 2016,media new phony kick management style spend much less money amp get much better results need prez
2160,False,"The failing @nytimes wrote a story about my management style &amp; that I don't have many people. I have 73, Hillary has 800- &amp; I'm beating her.",False,736655375911530498,16265,iphone,False,736655375911530498,5166,False,en,Sat May 28 20:28:22 +0000 2016,failing @nytimes wrote story management style amp many people hillary amp beating
2161,False,I (we) broke the all-time record for most votes gotten in a Republican Primary - by a lot - and with many states left to go! Thank you.,False,736569533738156036,27043,android,False,736569533738156036,7678,False,en,Sat May 28 14:47:16 +0000 2016,broke time record votes gotten republican primary lot many states left go thank
2162,False,"The U.S. has 69 treaties with other countries where we would have to defend them and their borders. How nice, but what do we get? NOT ENOUGH",False,736554410361409536,18534,android,False,736554410361409536,6824,False,en,Sat May 28 13:47:10 +0000 2016,u treaties countries would defend borders nice get enough
2163,False,"Great rally in Fresno, California- great crowd! Thank you! #Trump2016 https://t.co/TVSPvxOmve",False,736441853097218048,17401,iphone,False,736441853097218048,4676,False,en,Sat May 28 06:19:54 +0000 2016,great rally fresno california great crowd thank trump
2164,False,"Obama administration fails to screen Syrian refugees' social media accounts:
https://t.co/MMa07nwa44",False,736410143378792448,10419,iphone,False,736410143378792448,5033,False,en,Sat May 28 04:13:54 +0000 2016,obama administration fails screen syrian refugees social media accounts
2165,False,.@SanDiegoPD- Fantastic job on handling the thugs who tried to disrupt our very peaceful and well attended rally. Greatly appreciated!,False,736388616214220801,25494,iphone,False,736388616214220801,7367,False,en,Sat May 28 02:48:22 +0000 2016,@sandiegopd fantastic job handling thugs tried disrupt peaceful well attended rally greatly appreciated
2166,False,Thank you @BillyJoel- many friends just told me you gave a very kind shoutout at MSG. Appreciate it- love your music!,False,736381305785581568,16692,iphone,False,736381305785581568,4651,False,en,Sat May 28 02:19:19 +0000 2016,thank @billyjoel many friends told gave kind shoutout msg appreciate love music
2167,False,"Wow- 25,000 in San Diego, California!
Thank you!! #Trump2016 https://t.co/1NRj3zCuui",False,736336185086222336,21405,iphone,False,736336185086222336,7189,False,en,Fri May 27 23:20:01 +0000 2016,wow san diego california thank trump
2168,False,"I am on @oreillyfactor tonight, a big special. @FoxNews  at 8:00 P.M. ENJOY!",False,736336010808688640,8257,android,False,736336010808688640,1954,False,en,Fri May 27 23:19:20 +0000 2016,@oreillyfactor tonight big special @foxnews p enjoy
2169,False,"Bill O'Reilly doing a major special on @OreillyFactor tonight- @FoxNews at 8pmE. Watch it, should be good! #Trump2016",False,736249593352966144,10355,iphone,False,736249593352966144,2962,False,en,Fri May 27 17:35:56 +0000 2016,bill reilly major special @oreillyfactor tonight @foxnews pme watch good trump
