,truncated,text,is_quote_status,id,favorite_count,source,retweeted,id_str,retweet_count,favorited,lang,created_at,clean_text
642,False,"Join me tonight in Cedar Rapids, Iowa at 7pm: https://t.co/QWaEJpR79n

Phoenix, Arizona tomorrow night at 3pm: https://t.co/0LjE9qbNLh",False,792027901126406144,14145,iphone,False,792027901126406144,5619,False,en,Fri Oct 28 15:39:01 +0000 2016,join tonight cedar rapids iowa pm phoenix arizona tomorrow night pm
643,False,"""@Jmoschetti1363: @Johnatsrs1949 FBI must be outraged that their hands r tied she has no regard or t secret service, FBI, or (Dallas)police""",False,792024896616407040,19916,android,False,792024896616407040,8151,False,en,Fri Oct 28 15:27:05 +0000 2016,@jmoschetti @johnatsrs fbi must outraged hands r tied regard secret service fbi dallas police
644,False,RT @DRUDGE_REPORT: WSJ:  Grifters-in-Chief...  https://t.co/mPFocMuBgu,False,792015309058310145,0,iphone,False,792015309058310145,3499,False,en,Fri Oct 28 14:48:59 +0000 2016,rt @drudge report wsj grifters chief
645,False,"Join @TeamTrump on Facebook &amp; watch tonight's rally from Geneva, Ohio- our 3rd rally of the day. #AmericaFirst #MAGA https://t.co/ZqJmf4QcwH",False,791795308162408448,16043,iphone,False,791795308162408448,6331,False,en,Fri Oct 28 00:14:46 +0000 2016,join @teamtrump facebook amp watch tonight rally geneva ohio rd rally day americafirst maga
646,False,"""@KeithRowland: People in Arizona just got a taste of Obamacare with a 116% increase in premiums. @realDonaldTrump"" Repeal and replace!",False,791768269615169538,29099,android,False,791768269615169538,14778,False,en,Thu Oct 27 22:27:20 +0000 2016,@keithrowland people arizona got taste obamacare increase premiums @realdonaldtrump repeal replace
647,False,I will be interviewed on @oreillyfactor tonight at 8:00 P.M. Enjoy!,False,791767413465419777,18538,android,False,791767413465419777,5894,False,en,Thu Oct 27 22:23:56 +0000 2016,interviewed @oreillyfactor tonight p enjoy
648,False,"Join me live in Toledo, Ohio. Time to #DrainTheSwamp &amp; #MAGA!
https://t.co/NU39Mmlh1T",False,791748254991912960,12933,iphone,False,791748254991912960,4460,False,en,Thu Oct 27 21:07:48 +0000 2016,join live toledo ohio time draintheswamp amp maga
649,False,"Join me in Cedar Rapids, Iowa tomorrow at 7:00pm! #MAGA
https://t.co/QWaEJpzvKN https://t.co/CniHGkjp0v",False,791746832686682112,12962,iphone,False,791746832686682112,5055,False,en,Thu Oct 27 21:02:09 +0000 2016,join cedar rapids iowa tomorrow pm maga
650,False,"Join me live in Springfield, Ohio!
https://t.co/LREA7WRmOx",False,791697302519947264,12606,iphone,False,791697302519947264,4455,False,en,Thu Oct 27 17:45:20 +0000 2016,join live springfield ohio
651,False,"JOIN ME! #MAGA
TODAY:
Springfield, OH 
Toledo, OH 
Geneva, OH 
FRIDAY:
Manchester, NH 
Lisbon, ME 
Cedar Rapids, IA
https://t.co/kv624y9UOm",False,791651860889427968,17518,iphone,False,791651860889427968,7231,False,en,Thu Oct 27 14:44:46 +0000 2016,join maga today springfield oh toledo oh geneva oh friday manchester nh lisbon cedar rapids ia
652,False,"I agree, @MMFlint- To all Americans, I see you &amp; I hear you. I am your voice. Vote to #DrainTheSwamp w/ me on 11/8. https://t.co/D7nBwkogBb",False,791648893725450240,24547,iphone,False,791648893725450240,11853,False,en,Thu Oct 27 14:32:59 +0000 2016,agree @mmflint americans see amp hear voice vote draintheswamp w
653,False,"'WikiLeaks Drip-Drop Releases Prove One Thing: There's No Nov. 8 Deadline on Clinton's Dishonesty and Scandals'
https://t.co/MfRy3Nvd4F",False,791642669256769536,23277,iphone,False,791642669256769536,12503,False,en,Thu Oct 27 14:08:15 +0000 2016,wikileaks drip drop releases prove one thing nov deadline clinton dishonesty scandals
654,False,A lot of call-ins about vote flipping at the voting booths in Texas. People are not happy. BIG lines. What is going on?,False,791625798792974336,40056,android,False,791625798792974336,19792,False,en,Thu Oct 27 13:01:12 +0000 2016,lot call ins vote flipping voting booths texas people happy big lines going
655,False,REPEAL AND REPLACE OBAMACARE!,False,791233632593739776,54102,android,False,791233632593739776,19846,False,en,Wed Oct 26 11:02:53 +0000 2016,repeal replace obamacare
656,False,"Thank you Tallahassee, Florida! A beautiful evening with the MOVEMENT! Get out &amp; VOTE!
#ICYMI- watch here: https://t.co/GDKhwrCa9R",False,791059759663288321,25316,iphone,False,791059759663288321,9847,False,en,Tue Oct 25 23:31:58 +0000 2016,thank tallahassee florida beautiful evening movement get amp vote icymi watch
657,False,"REPEAL AND REPLACE!!! 
#ObamaCareInThreeWords",False,791037075030179840,38488,iphone,False,791037075030179840,16695,False,en,Tue Oct 25 22:01:50 +0000 2016,repeal replace obamacareinthreewords
658,False,"Get your ballots in Colorado - I will see you soon -- and we will win!
#MakeAmericaGreatAgain https://t.co/oDLvZg7MLk",False,791030789001605126,22340,iphone,False,791030789001605126,8888,False,en,Tue Oct 25 21:36:51 +0000 2016,get ballots colorado see soon win makeamericagreatagain
659,False,"'Obama Warned Of Rigged Elections In 2008.' Time to #DrainTheSwamp
https://t.co/AkczH8l0FJ https://t.co/7mIkwAHTuV",False,791022438486343680,25651,iphone,False,791022438486343680,15678,False,en,Tue Oct 25 21:03:40 +0000 2016,obama warned rigged elections time draintheswamp
660,False,"Obamacare is a disaster. Rates going through the sky - ready to explode. I will fix it. Hillary can't!
#ObamacareFailed",False,791017424426504192,32608,iphone,False,791017424426504192,13016,False,en,Tue Oct 25 20:43:45 +0000 2016,obamacare disaster rates going sky ready explode fix hillary obamacarefailed
661,False,"Obamacare is a disaster - as I've been saying from the beginning. Time to repeal &amp; replace! 
#ObamacareFail https://t.co/5CvoMbVceT",False,790951230906458113,31266,iphone,False,790951230906458113,17014,False,en,Tue Oct 25 16:20:43 +0000 2016,obamacare disaster saying beginning time repeal amp replace obamacarefail
662,False,#ObamacareFail https://t.co/90Aixp25Oc,False,790948782288596992,20858,iphone,False,790948782288596992,11894,False,und,Tue Oct 25 16:10:59 +0000 2016,obamacarefail
663,False,"Obamacare is a disaster! Time to repeal &amp; replace! #ObamacareFail 
https://t.co/xDPhVczf1g",False,790936603590033408,17092,iphone,False,790936603590033408,7871,False,en,Tue Oct 25 15:22:35 +0000 2016,obamacare disaster time repeal amp replace obamacarefail
664,False,#ObamacareFail https://t.co/5Zvsys8j5w,False,790936360953716736,14499,iphone,False,790936360953716736,7067,False,und,Tue Oct 25 15:21:37 +0000 2016,obamacarefail
665,False,#ObamacareFail https://t.co/Mb0YW1rg6g,False,790936027871477764,23009,iphone,False,790936027871477764,12406,False,und,Tue Oct 25 15:20:18 +0000 2016,obamacarefail
666,False,Get out and vote! I am your voice and I will fight for you! We will make America great again! https://t.co/XXvLRlhSaz,False,790927104921767940,27854,iphone,False,790927104921767940,13009,False,en,Tue Oct 25 14:44:51 +0000 2016,get vote voice fight make america great
667,False,"Key Obamacare premiums to jump 25% next year:
https://t.co/TCdHEdPQDG",False,790925669937123328,14271,iphone,False,790925669937123328,8164,False,en,Tue Oct 25 14:39:09 +0000 2016,key obamacare premiums jump next year
668,False,#Obamacare premiums are about to SKYROCKET --- again. Crooked H will only make it worse. We will repeal &amp; replace! https://t.co/fY1REYV4rK,False,790924363348541445,17526,iphone,False,790924363348541445,9257,False,en,Tue Oct 25 14:33:57 +0000 2016,obamacare premiums skyrocket crooked h make worse repeal amp replace
669,False,"As election looms, some bad news for Clinton, Democrats:
https://t.co/7aWWVQPjTo",False,790923701193768960,15684,iphone,False,790923701193768960,8353,False,en,Tue Oct 25 14:31:19 +0000 2016,election looms bad news clinton democrats
670,False,Thank you Bobby Bowden for the intro tonight and your support! I hope I can do as well for Florida as you have done! https://t.co/Vx5iltoaXj,False,790726388978515968,37801,iphone,False,790726388978515968,15738,False,en,Tue Oct 25 01:27:16 +0000 2016,thank bobby bowden intro tonight support hope well florida done
671,False,"My contract with the American voter will restore honesty, accountability &amp; CHANGE to Washington! #DrainTheSwamp https://t.co/sbVwctT1Sj",False,790712761407926272,40534,iphone,False,790712761407926272,21571,False,en,Tue Oct 25 00:33:07 +0000 2016,contract american voter restore honesty accountability amp change washington draintheswamp
672,False,"Peter Navarro: 'Trump the Bull vs. Clinton the Bear' #DrainTheSwamp 
https://t.co/mQRkfMG80j",False,790672365466316800,13627,iphone,False,790672365466316800,6184,False,en,Mon Oct 24 21:52:36 +0000 2016,peter navarro trump bull vs clinton bear draintheswamp
673,False,"'Democratic operative caught on camera: Hillary PERSONALLY ordered 'Donald Duck' troll campaign that broke the law'
https://t.co/sTreHAfYUH",False,790671814276083712,29766,iphone,False,790671814276083712,19459,False,en,Mon Oct 24 21:50:25 +0000 2016,democratic operative caught camera hillary personally ordered donald duck troll campaign broke law
674,False,"Join me tomorrow in Sanford or Tallahassee, Florida!

Sanford at 3pm:
https://t.co/PZENw9Kheg

Tallahassee at 6pm:
https://t.co/WKI69e1bqD",False,790662999841333249,13794,iphone,False,790662999841333249,5925,False,en,Mon Oct 24 21:15:23 +0000 2016,join tomorrow sanford tallahassee florida sanford pm tallahassee pm
675,False,'Hillary Clinton Had Gun Control Supporters Planted In Town Hall Audience' https://t.co/1GVq74iW8a,False,790593186787840000,18603,iphone,False,790593186787840000,11451,False,en,Mon Oct 24 16:37:58 +0000 2016,hillary clinton gun control supporters planted town hall audience
676,False,"Get out to VOTE on 11/8/2016- and we will #DrainTheSwamp!
RASMUSSEN NATIONAL 
Trump 43%
Clinton 41% https://t.co/jIOR7Bq816",False,790565076159922177,31747,iphone,False,790565076159922177,14995,False,en,Mon Oct 24 14:46:16 +0000 2016,get vote draintheswamp rasmussen national trump clinton
677,False,We are winning and the press is refusing to report it. Don't let them fool you- get out and vote! #DrainTheSwamp on November 8th!,False,790557856806371328,49254,iphone,False,790557856806371328,22706,False,en,Mon Oct 24 14:17:35 +0000 2016,winning press refusing report let fool get vote draintheswamp november th
678,False,Why has nobody asked Kaine about the horrible views emanated on WikiLeaks about Catholics? Media in the tank for Clinton but Trump will win!,False,790539740118446080,37240,iphone,False,790539740118446080,14762,False,en,Mon Oct 24 13:05:36 +0000 2016,nobody asked kaine horrible views emanated wikileaks catholics media tank clinton trump win
679,False,Major story that the Dems are making up phony polls in order to suppress the the Trump . We are going to WIN!,False,790534428942622721,44793,android,False,790534428942622721,18955,False,en,Mon Oct 24 12:44:29 +0000 2016,major story dems making phony polls order suppress trump going win
680,False,"Wow, just came out on secret tape that Crooked Hillary wants to take in as many Syrians as possible. We cannot let this happen - ISIS!",False,790523240351498241,54214,android,False,790523240351498241,25799,False,en,Mon Oct 24 12:00:02 +0000 2016,wow came secret tape crooked hillary wants take many syrians possible cannot let happen isis
681,False,"'Clinton Charity Got Up To $56 Million From Nations That Are Anti-Women, Gays' #CrookedHillary
https://t.co/eHsuBdi8XM",False,790343997814403072,24979,iphone,False,790343997814403072,16957,False,en,Mon Oct 24 00:07:47 +0000 2016,clinton charity got million nations anti women gays crookedhillary
682,False,The attack on Mosul is turning out to be a total disaster. We gave them months of notice. U.S. is looking so dumb. VOTE TRUMP and WIN AGAIN!,False,790337063489040384,41123,android,False,790337063489040384,16265,False,en,Sun Oct 23 23:40:14 +0000 2016,attack mosul turning total disaster gave months notice u looking dumb vote trump win
683,False,#CrookedHillary #PayToPlay https://t.co/BT1Nv0ZMYg,False,790268732354461696,27162,iphone,False,790268732354461696,16314,False,und,Sun Oct 23 19:08:42 +0000 2016,crookedhillary paytoplay
684,False,"Join me in Naples, Florida this evening at 6:00pm! Tickets: https://t.co/Oax06JVzv1 https://t.co/g9LBxI1dJ8",False,790250615398133760,17131,iphone,False,790250615398133760,6344,False,en,Sun Oct 23 17:56:43 +0000 2016,join naples florida evening pm tickets
685,False,Remember - get out on November 8th &amp; VOTE #TrumpPence16. It is time to #DrainTheSwamp -- this is our last chance! https://t.co/bnGcJUt7UL,False,790229932341354496,24064,iphone,False,790229932341354496,11416,False,en,Sun Oct 23 16:34:32 +0000 2016,remember get november th amp vote trumppence time draintheswamp last chance
686,False,"Thank you Las Vegas Review Journal! 
EDITORIAL: 'Donald Trump for president' https://t.co/uH5GH7Bhe0 via @reviewjournal",False,790227242500644864,19920,iphone,False,790227242500644864,9187,False,en,Sun Oct 23 16:23:50 +0000 2016,thank las vegas review journal editorial donald trump president via @reviewjournal
687,False,"Well, Iran has done it again. Taken two of our people and asking for a fortune for their release. This doesn't happen if I'm president!",False,790192053489729538,59082,android,False,790192053489729538,25664,False,en,Sun Oct 23 14:04:01 +0000 2016,well iran done taken two people asking fortune release happen president
688,False,"""If you can't run your own house you certainly can't run the White House"" A statement made by Mrs. Obama about Crooked Hillary Clinton",False,790174395985788929,58815,android,False,790174395985788929,25703,False,en,Sun Oct 23 12:53:51 +0000 2016,run house certainly run white house statement made mrs obama crooked hillary clinton
689,False,"WikiLeaks: 'Clinton-Kaine Even Lied About Timing of Veep Pick'
https://t.co/e1NVdpSfNr",False,790016528011890688,21329,iphone,False,790016528011890688,12210,False,en,Sun Oct 23 02:26:32 +0000 2016,wikileaks clinton kaine even lied timing veep pick
690,False,"'Trump lays out policies for first 100 days in White House'
https://t.co/OrwOIFJuSz",False,790015269074792448,25257,iphone,False,790015269074792448,11977,False,en,Sun Oct 23 02:21:32 +0000 2016,trump lays policies first days white house
691,False,"'Huma Abedin told Clinton her secret email account caused problems'
https://t.co/i4zN2QzKnf",False,790011110984445952,19949,iphone,False,790011110984445952,11730,False,en,Sun Oct 23 02:05:01 +0000 2016,huma abedin told clinton secret email account caused problems
692,False,"Just arrived in Cleveland, Ohio- join Governor @Mike_Pence and I now, LIVE via: https://t.co/SS58ChFTNy",False,789966670630715394,17029,iphone,False,789966670630715394,6385,False,en,Sat Oct 22 23:08:25 +0000 2016,arrived cleveland ohio join governor @mike pence live via
693,False,"Hillary Clinton: 'Architect of failure'
#DrainTheSwamp #CrookedHillary
https://t.co/b5HqsGrc7N",False,789943092564652032,19772,iphone,False,789943092564652032,10275,False,en,Sat Oct 22 21:34:44 +0000 2016,hillary clinton architect failure draintheswamp crookedhillary
694,False,"In order to #DrainTheSwamp &amp; create a new GOVERNMENT of, by, &amp; for the PEOPLE, I need your VOTE! Go to https://t.co/HfihPERFgZ- LET'S #MAGA!",False,789917911821520898,26359,iphone,False,789917911821520898,12307,False,en,Sat Oct 22 19:54:40 +0000 2016,order draintheswamp amp create new government amp people need vote go let maga
695,False,Change has to come from outside our very broken system. #MAGA https://t.co/OH9Lvo3R7K,False,789893765397897216,32171,iphone,False,789893765397897216,14042,False,en,Sat Oct 22 18:18:43 +0000 2016,change come outside broken system maga
696,False,"Thank you Gettysburg, Pennsylvania! #DrainTheSwamp https://t.co/jWgLcxDji7",True,789886518303330304,23059,iphone,False,789886518303330304,9825,False,en,Sat Oct 22 17:49:56 +0000 2016,thank gettysburg pennsylvania draintheswamp
697,False,"Will be in Cleveland, Ohio w/ @mike_pence tonight- join us: https://t.co/hre7FofPxQ

Naples, Florida-tomorrow @ 6pm: https://t.co/Oax06JVzv1",False,789828981197602816,15022,iphone,False,789828981197602816,5914,False,en,Sat Oct 22 14:01:18 +0000 2016,cleveland ohio w @mike pence tonight join us naples florida tomorrow @ pm
698,False,"""@jensen4law: Best way to pay Hillary back for what she did to @BernieSanders #DNCleak is a DonaldTrump LANDSLIDE https://t.co/Ha8o5wCyGh""",True,789792240390533124,25385,android,False,789792240390533124,14090,False,en,Sat Oct 22 11:35:18 +0000 2016,@jensen law best way pay hillary back @berniesanders dncleak donaldtrump landslide
699,False,The media refuses to talk about the three new national polls that have me in first place. Biggest crowds ever - watch what happens!,False,789671091182632960,63144,android,False,789671091182632960,23718,False,en,Sat Oct 22 03:33:54 +0000 2016,media refuses talk three new national polls first place biggest crowds ever watch happens
700,False,"Just returned from Pennsylvania where we will be bringing back their jobs. Amazing crowd. Will be going back tomorrow, to Gettysburg!",False,789668492480016384,36573,android,False,789668492480016384,11100,False,en,Sat Oct 22 03:23:34 +0000 2016,returned pennsylvania bringing back jobs amazing crowd going back tomorrow gettysburg
701,False,Donna Brazile Shreds Obama Economy - Acting DNC chair says 'people are more in despair about how things are' https://t.co/LQNbISSoX0,False,789596138462650372,20825,iphone,False,789596138462650372,11453,False,en,Fri Oct 21 22:36:04 +0000 2016,donna brazile shreds obama economy acting dnc chair says people despair things
702,False,"""{Crooked Hillary Clinton} created this mess, and she knows it."" 
#DrainTheSwamp https://t.co/3cBNYjl5CD https://t.co/sjwkuq3nkk",False,789594671387447297,19698,iphone,False,789594671387447297,11475,False,en,Fri Oct 21 22:30:14 +0000 2016,crooked hillary clinton created mess knows draintheswamp
703,False,"'Clinton Campaign And Harry Reid Worked With New York Times To Smear State Dept Watchdog'
Time to #DrainTheSwamp! 
https://t.co/0VDdGdpCTg",False,789590785733918721,16867,iphone,False,789590785733918721,9731,False,en,Fri Oct 21 22:14:47 +0000 2016,clinton campaign harry reid worked new york times smear state dept watchdog time draintheswamp
704,False,"The results are in on the final debate and it is almost unanimous, I WON! Thank you, these are very exciting times.",False,789520268972601344,56436,android,False,789520268972601344,16787,False,en,Fri Oct 21 17:34:35 +0000 2016,results final debate almost unanimous thank exciting times
705,False,"Huma calls it a ""MESS,"" the rest of us call it CORRUPT! WikiLeaks catches Crooked in the act - again.
#DrainTheSwamp https://t.co/juvdLIJPWu",False,789487320290430976,25058,iphone,False,789487320290430976,14917,False,en,Fri Oct 21 15:23:39 +0000 2016,huma calls mess rest us call corrupt wikileaks catches crooked act draintheswamp
706,False,"Hillary &amp; Obama's Broken Promises. 
#RepealObamacare https://t.co/oz24r2xW7G",False,789226753831075841,24816,iphone,False,789226753831075841,13415,False,en,Thu Oct 20 22:08:15 +0000 2016,hillary amp obama broken promises repealobamacare
707,False,"RT @TeamTrump: When Obama took office in 2009 employer-provided premiums cost $13,375. Today they are $18,142. Thanks, Obama.",False,789223460853735425,0,iphone,False,789223460853735425,8814,False,en,Thu Oct 20 21:55:10 +0000 2016,rt @teamtrump obama took office employer provided premiums cost today thanks obama
708,False,"Crooked Hillary promised 200k jobs in NY and FAILED. We'll create 25M jobs when I'm president, and I will DELIVER! https://t.co/NgyCkEH7Xn",False,789202030493634560,24683,iphone,False,789202030493634560,12203,False,en,Thu Oct 20 20:30:01 +0000 2016,crooked hillary promised k jobs ny failed create jobs president deliver
709,False,"'Trump won the third debate'
https://t.co/Wh52fyLNRz",False,789196063819390976,26307,iphone,False,789196063819390976,10710,False,en,Thu Oct 20 20:06:18 +0000 2016,trump third debate
710,False,"UPCOMING RALLIES - JOIN ME!

TOMORROW
Fletcher, NC @ 12pm. 
https://t.co/uASvA4Gd4r

SATURDAY
Cleveland, OH @ 7pm. 
https://t.co/hre7Foxqpo",False,789192459179790337,12997,iphone,False,789192459179790337,5731,False,en,Thu Oct 20 19:51:59 +0000 2016,upcoming rallies join tomorrow fletcher nc @ pm saturday cleveland oh @ pm
711,False,"#ICYMI - OHIO RALLY!
Watch here: https://t.co/0qAjfOcu6Y https://t.co/fpShHiXI31",False,789192376002551810,13291,iphone,False,789192376002551810,5140,False,en,Thu Oct 20 19:51:39 +0000 2016,icymi ohio rally watch
712,False,"Want access to Crooked Hillary? Don't forget - it's going to cost you!
#DrainTheSwamp #PayToPlay https://t.co/qjMBZkEnK9",False,789170710270742528,29353,iphone,False,789170710270742528,15241,False,en,Thu Oct 20 18:25:34 +0000 2016,want access crooked hillary forget going cost draintheswamp paytoplay
713,False,Why didn't Hillary Clinton announce that she was inappropriately given the debate questions - she secretly used them! Crooked Hillary.,False,789117930801926148,50091,android,False,789117930801926148,19459,False,en,Thu Oct 20 14:55:50 +0000 2016,hillary clinton announce inappropriately given debate questions secretly used crooked hillary
714,False,"Thank you America! #MAGA

Rasmussen National Poll
Donald Trump 43%
Hillary Clinton 40% https://t.co/n4eZ3qpcjg",False,789095747635572736,43955,iphone,False,789095747635572736,20120,False,en,Thu Oct 20 13:27:41 +0000 2016,thank america maga rasmussen national poll donald trump hillary clinton
715,False,"Totally dishonest Donna Brazile chokes on the truth. Highly illegal! 
Watch: https://t.co/Rs5brj31bA https://t.co/FYoRo6MUjX",False,788959791179767808,34904,iphone,False,788959791179767808,17588,False,en,Thu Oct 20 04:27:27 +0000 2016,totally dishonest donna brazile chokes truth highly illegal watch
716,False,"The Washington Times Presidential Debate Poll:
TRUMP 77% (18,290)
CLINTON 17% (4,100)
#DrainTheSwamp #Debate https://t.co/wsgsf5nv6H",False,788957439542587392,44498,iphone,False,788957439542587392,21101,False,en,Thu Oct 20 04:18:06 +0000 2016,washington times presidential debate poll trump clinton draintheswamp debate
717,False,"Join the MOVEMENT to #MAGA!
https://t.co/3KWOl2ibaW https://t.co/V84qfN4oz1",True,788955427975393281,19851,iphone,False,788955427975393281,9068,False,en,Thu Oct 20 04:10:06 +0000 2016,join movement maga
718,False,That was really exciting. Made all of my points. MAKE AMERICA GREAT AGAIN!,False,788937644642213888,71509,android,False,788937644642213888,22251,False,en,Thu Oct 20 02:59:26 +0000 2016,really exciting made points make america great
719,False,"Join my team over on my Facebook page- live now! #Debates
https://t.co/vpDVQfO58A https://t.co/5v1tWzHrxq",False,788935685088477185,12718,iphone,False,788935685088477185,4597,False,en,Thu Oct 20 02:51:39 +0000 2016,join team facebook page live debates
720,False,"HILLARY'S HEALTH CARE POLICIES
#DrainTheSwamp #Debate https://t.co/t1Sr8dk2Xi",False,788931248672563200,15859,iphone,False,788931248672563200,7249,False,en,Thu Oct 20 02:34:01 +0000 2016,hillary health care policies draintheswamp debate
721,False,We have to repeal &amp; replace #Obamacare! Look at what is doing to people! #DrainTheSwamp https://t.co/fsv7P11mWV,False,788930977301090304,25024,iphone,False,788930977301090304,15210,False,en,Thu Oct 20 02:32:57 +0000 2016,repeal amp replace obamacare look people draintheswamp
722,False,"The economy cannot take four more years of these same failed policies.
#BigLeagueTruth #DrainTheSwamp https://t.co/o8g2E5xXy6",False,788930515520724992,16168,iphone,False,788930515520724992,7785,False,en,Thu Oct 20 02:31:07 +0000 2016,economy cannot take four years failed policies bigleaguetruth draintheswamp
723,False,"Together we can save American JOBS, American LIVES, and AMERICAN FUTURES! #Debates https://t.co/2Yfd0Omn4X",False,788930105976299521,15438,iphone,False,788930105976299521,6793,False,en,Thu Oct 20 02:29:29 +0000 2016,together save american jobs american lives american futures debates
724,False,USA has the greatest business people in the world but we let political hacks negotiate our deals. We need change! #BigLeagueTruth #Debate,False,788929804351385600,21095,web,False,788929804351385600,8323,False,en,Thu Oct 20 02:28:17 +0000 2016,usa greatest business people world let political hacks negotiate deals need change bigleaguetruth debate
725,False,"I WILL DEFEAT ISIS. THEY HAVE BEEN AROUND TOO LONG! What has our leadership been doing?
#DrainTheSwamp https://t.co/tU0iW3Gi9v",False,788929609458823168,14166,iphone,False,788929609458823168,6492,False,en,Thu Oct 20 02:27:31 +0000 2016,defeat isis around long leadership draintheswamp
726,False,"After Crooked @HillaryClinton allowed ISIS to rise, she now claims she'll defeat them? LAUGHABLE! Here's my plan: https://t.co/FzRMObNQVn",False,788929328696348674,15176,web,False,788929328696348674,7114,False,en,Thu Oct 20 02:26:24 +0000 2016,crooked @hillaryclinton allowed isis rise claims defeat laughable plan
727,False,"RT @TeamTrump: ""Her instincts are suboptimal.""
https://t.co/PRCHvRtPVA",False,788928851019653120,0,web,False,788928851019653120,2929,False,en,Thu Oct 20 02:24:30 +0000 2016,rt @teamtrump instincts suboptimal
728,False,"I opposed going into Iraq. Hillary voted for it. As with everything else she's supported, it was a DISASTER. https://t.co/Um5WJXWfBZ",False,788928106950070272,14143,web,False,788928106950070272,6522,False,en,Thu Oct 20 02:21:32 +0000 2016,opposed going iraq hillary voted everything else supported disaster
729,False,#BigLeagueTruth #DrainTheSwamp https://t.co/eoBiXFPc5f,False,788928050008207360,9327,iphone,False,788928050008207360,4211,False,und,Thu Oct 20 02:21:19 +0000 2016,bigleaguetruth draintheswamp
