date,clean_text,Unnamed: 2,compound_polarity
2015-05-05 00:00:00,watch live hillary sits dreamers rancho high school nevada talk immigration reform,,0.0
2015-05-06 00:00:00,join campaign agree hillary comprehensive immigration reform,,0.6908
2015-05-06 00:00:00,sign agree fixing immigration system right thing,,0.3612
2015-05-06 00:00:00,sign hillary comprehensive immigration reform,,0.25
2015-05-06 00:00:00,time fix broken immigration system read hillary remarks nevada earlier,,-0.4767
2015-05-07 00:00:00,congress move ahead usa freedom act good step forward ongoing efforts protect security civil liberties h,,0.9371
2015-05-07 00:00:00,hillary visited nevada week talk dreamers immigration reform see photos,,0.0
2015-05-07 00:00:00,midnight deadline mom could call mom love sign enter,,0.6369
2015-05-07 00:00:00,never know could missing following hillary flickr,,0.2235
2015-05-07 00:00:00,tea good company smallbusinessweek thanks @mayoredlee h,,0.7003
2015-05-08 00:00:00,even better mother day first mother day grandmother sign hillary card,,0.4404
2015-05-08 00:00:00,ff @thebriefing go place cut noise get facts sign,,0.1779
2015-05-08 00:00:00,happy friday one item list join hillary campaign today,,0.7096
2015-05-09 00:00:00,add name wish favorite mom grandmother happy mother day,,0.8555
2015-05-09 00:00:00,agree hillary add name let know,,0.3612
2015-05-10 00:00:00,best mother day gift seeing daughter become mom happy mother day @chelseaclinton every mom grandma h,,0.8957
2015-05-10 00:00:00,daughter mother grandmother fierce champion mothers children families,,0.5994
2015-05-10 00:00:00,share hillary mother day video mom love,,0.7506
2015-05-11 00:00:00,agree make easier raise family guarantee paid family leave,,0.7269
2015-05-11 00:00:00,avoid fomo become hillary founding donor window closes,,-0.296
2015-05-11 00:00:00,healthy women healthy communities sign agree hillary nwhw,,0.7845
2015-05-11 00:00:00,lucky moms got mother day surprise remember today call hillary,,0.5994
2015-05-11 00:00:00,note selfie join hillary today,,0.296
2015-05-11 00:00:00,smart paidleave pieces @iamjohnoliver funny @ezraklein wonderfully wonky h,,0.8591
2015-05-12 00:00:00,campaign manager robby mook finalizing founding donor list make sure name,,0.3182
2015-05-12 00:00:00,flash giveaway donate p et win custom phone wallpaper,,0.5859
2015-05-12 00:00:00,high five one month since hillary launched join campaign,,0.4019
2015-05-12 00:00:00,let go,,0.0
2015-05-12 00:00:00,tell hillary fight every day kids families always done,,-0.3818
2015-05-12 00:00:00,want personalized h chip become founding donor next donors win,,0.6249
2015-05-13 00:00:00,agree hillary,,0.3612
2015-05-13 00:00:00,agree priorities backward add name,,0.3612
2015-05-13 00:00:00,comes women health two kinds experts women doctors true years ago true today h,,0.6808
2015-05-13 00:00:00,heartbroken passengers families affected amtrak grateful first responders scene h,,-0.4404
2015-05-13 00:00:00,hillary supporters bringing campaign new heights thanks stopping @jasoncollins,,0.6369
2015-05-13 00:00:00,hillary winning team sign volunteer,,0.5267
2015-05-13 00:00:00,last chance become hillary founding donor midnight window closes forever,,0.25
2015-05-13 00:00:00,workers choose staying healthy staying job helps everyone @facebook,,0.6486
2015-05-14 00:00:00,harriet tubman could first woman bill awesome well deserved time womenon,,0.7351
2015-05-14 00:00:00,hillary ramping across country take look,,0.0
2015-05-14 00:00:00,hillary wrote letter couple featured announcement video definitely want read,,0.4588
2015-05-14 00:00:00,want support hillary luck,,0.7184
2015-05-14 00:00:00,words ring truer ever today human rights women rights women rights human rights tbt,,0.3612
2015-05-15 00:00:00,ever wanted share story sign join hillary email list next email could,,0.5267
2015-05-15 00:00:00,greetings brooklyn usa,,0.4215
2015-05-15 00:00:00,say bey team hillary,,0.0
2015-05-15 00:00:00,saying hi new neighbors,,0.0
2015-05-16 00:00:00,awesome join dave,,0.743
2015-05-16 00:00:00,brooklyn welcomes hillary neighborhood,,0.4019
2015-05-16 00:00:00,hope much fun weekend,,0.7351
2015-05-16 00:00:00,part team sign volunteer hillary,,0.0
2015-05-17 00:00:00,join hillary agree every child given opportunity reach full potential,,0.765
2015-05-18 00:00:00,consider message year old give yes real name give take vowel,,0.4019
2015-05-18 00:00:00,hillary ramping one person one conversation one community time volunteer,,0.0
2015-05-18 00:00:00,see soon iowa follow @hillaryforia updates hillary visit week,,0.0
2015-05-18 00:00:00,wake go office elect hillary sound like work want go,,0.4215
2015-05-19 00:00:00,@smarino @enlaurent @ginamaria thank grateful inspired hard work campaign everyday iowans h,,0.8074
2015-05-19 00:00:00,agree hillary small business heart economy,,0.3612
2015-05-19 00:00:00,break hardworking families contribute economy society fight dapa h,,-0.3818
2015-05-19 00:00:00,fireside chat mason city iowa,,0.0
2015-05-19 00:00:00,hillary exchanging ideas strengthening small business real experts watch live,,0.4939
2015-05-19 00:00:00,mean small business president read,,0.0
2015-05-19 00:00:00,president small business like sound,,0.3612
2015-05-19 00:00:00,yep beyonc get best hillary moments delivered inbox sign feed,,0.7506
2015-05-20 00:00:00,big news hillary first big rally could enter,,0.0
2015-05-20 00:00:00,could tell hillary team would say,,0.0
2015-05-20 00:00:00,food thought big hillary fan volunteering via @johnbuysse,,0.3182
2015-05-20 00:00:00,hillary reading timely reminder need remove barriers empower small business growth,,0.3818
2015-05-20 00:00:00,short change childcare workers short change kids america future hrc @seiu chicago,,0.0
2015-05-20 00:00:00,take girl midwest,,0.0
2015-05-20 00:00:00,welcome @mintimm @lorellapraeli great advocates women latinos two newest members hillary let go,,0.7964
2015-05-21 00:00:00,back @kelly clarkson via @rollingstone,,0.0
2015-05-21 00:00:00,best part owning business enabled become single mom gives security flexibility mom,,0.8402
2015-05-21 00:00:00,business powerful force change something significant community work proud create jobs give back,,0.8316
2015-05-21 00:00:00,collaboration rush web project came impossible deadline,,0.0
2015-05-21 00:00:00,david vp reason life works took check signing haley born still today,,0.0
2015-05-21 00:00:00,get excited hillary making official campaign announcement speech first big event campaign june th,,0.34
2015-05-21 00:00:00,haley light life wants run company true bossy leaders,,0.4215
2015-05-21 00:00:00,love team thanks coming along us today,,0.7964
2015-05-21 00:00:00,mary jo right business powerful force change certainly thanks inviting us one tweet time h,,0.8555
2015-05-21 00:00:00,matt left photo talented senior designer us since student intern,,0.5106
2015-05-21 00:00:00,morning checklist wake take haley yo school get coffee way got special h today,,0.4019
2015-05-21 00:00:00,never meant start company studied fine art unh parents horror lucky support loved,,0.7579
2015-05-21 00:00:00,one favorite proudest things business owner pro bono work every year donate year worth work non profit,,0.886
2015-05-21 00:00:00,owning business managing projects budgets people lot work people aspect toughest rewarding,,0.4767
2015-05-21 00:00:00,really proud space built together clients bring us things add museum,,0.5256
2015-05-21 00:00:00,remove barriers focus important things supporting employees good work contributing communities,,0.765
2015-05-21 00:00:00,thanks opportunity hillary thank fighting women business owners like,,0.802
2015-05-21 00:00:00,wall inspiration staff members select inspires put spot gloria steinem,,0.743
2015-05-21 00:00:00,want meet hillary know friend free idea tag make deal,,0.7783
2015-05-21 00:00:00,want say equality women important hillary deep understanding live understand means lot,,0.2732
2015-05-22 00:00:00,great event brewing @smuttynosebeer hampton nh watch hillary small business roundtable live,,0.8074
2015-05-22 00:00:00,lgbtq rights human rights human rights lgbtq rights harveymilkday,,0.0
2015-05-22 00:00:00,looking good join @michellermanno support hillary,,0.7783
2015-05-22 00:00:00,never know meet hillary volunteer,,0.0
2015-05-22 00:00:00,official hillary shop coming soon sign get opens,,0.0
2015-05-22 00:00:00,see soon new hampshire,,0.0
2015-05-22 00:00:00,thanks iowa,,0.4404
2015-05-22 00:00:00,today really cool things,,0.3804
2015-05-23 00:00:00,car magnets get,,0.0
2015-05-23 00:00:00,sign chance meet hillary selfie included,,0.25
2015-05-23 00:00:00,step say help hillary step great long weekend,,0.7783
2015-05-23 00:00:00,thanks seacoast hospitality new hampshire,,0.4404
2015-05-23 00:00:00,well done ireland h,,0.2732
2015-05-24 00:00:00,get hillary swag store opens spend savings sunscreen,,0.0
2015-05-24 00:00:00,stopping ice cream derry nh else,,0.3818
2015-05-25 00:00:00,good advice hillary,,0.4404
2015-05-25 00:00:00,respect gratitude fallen servicemembers families,,0.5994
2015-05-25 00:00:00,sacred responsibility serve sacrifice country today remember honor values fought h,,0.5574
2015-05-25 00:00:00,win free trip meet hillary need say,,0.7964
2015-05-26 00:00:00,airfare covered chance meet hillary enter email,,0.25
2015-05-26 00:00:00,exclusive sneak peek hillary store ahead,,0.128
2015-05-26 00:00:00,open official hillary store start shopping,,0.0
2015-05-26 00:00:00,pantsuit,,0.0
2015-05-26 00:00:00,thanks @jimmyfallon actually prefer,,0.4404
2015-05-26 00:00:00,today celebrate sally ride pioneer showed generations girls sky longer limit,,0.5719
2015-05-26 00:00:00,week feed hit inboxes make sure signed goes,,0.3182
2015-05-27 00:00:00,going fast already order get second batch,,0.0
2015-05-27 00:00:00,hillary equal pay women issue family issue american economic issue,,-0.1027
2015-05-27 00:00:00,know hillary fight equal pay years learn record ideas,,-0.4588
2015-05-27 00:00:00,pillow place house order sells,,0.0
2015-05-27 00:00:00,th circuit wrong immigration @potus followed precedent took steps families gop house must continue fight h,,-0.6908
2015-05-28 00:00:00,champion everyday americans talking also listening,,0.5994
2015-05-28 00:00:00,hometown pride,,0.34
2015-05-28 00:00:00,moment reflection campaign trail hillary reverend hunt talk faith south carolina bakery,,0.4215
2015-05-29 00:00:00, ,,0.0
2015-05-29 00:00:00,first big event hillary campaign enter midnight,,0.0
2015-05-29 00:00:00,girls wanna fun bumper stickers get thanks @lenadunham,,0.7351
2015-05-29 00:00:00,happy friday fashion icon @johnpodesta,,0.5719
2015-05-29 00:00:00,hats weekend,,0.0
2015-05-29 00:00:00,highlights hillaryinsc small business equal pay local specialties,,-0.1027
2015-05-29 00:00:00,join hillary list need spell email address,,0.296
2015-05-29 00:00:00,two ls one,,0.0
2015-05-29 00:00:00,win free trip hang hillary deadline enter tonight miss,,0.7579
2015-05-30 00:00:00,one hillary favorite moments week,,0.4588
2015-05-30 00:00:00,summer essentials sunglasses iced tea tank,,0.0
2015-05-30 00:00:00,welcome race gov malley looking forward discussing strong families communities h,,0.743
2015-05-31 00:00:00,big hillary news announce official campaign launch location soon one first know,,0.0
2015-05-31 00:00:00,heart broken family beau biden wonderful man served country devotion lived life courage h,,0.7783
2015-05-31 00:00:00,lot good reasons team hillary,,0.4404
2015-06-01 00:00:00,breaking start spreading news hillary kicks could,,0.0
2015-06-01 00:00:00,happy pride month hoping june one history books h,,0.836
2015-06-01 00:00:00,hillary pride shop open soon sign first line,,0.34
2015-06-01 00:00:00,minus minutes location official hillary launch announced right,,0.0
2015-06-01 00:00:00,sew true via @leighannkopans,,0.4215
2015-06-01 00:00:00,substance abuse affected community share thoughts,,-0.5574
2015-06-01 00:00:00,sweet dreams,,0.6908
2015-06-02 00:00:00,aaron grandpa hillary,,0.0
2015-06-02 00:00:00,big news hillary launching campaign nyc part airfare covered,,0.0
2015-06-02 00:00:00,miss,,-0.1531
2015-06-02 00:00:00,psyched hillary volunteering,,0.0
2015-06-02 00:00:00,show support hillary equality check brand new pride shop open,,0.6249
2015-06-02 00:00:00,yaaas indeed,,0.0
2015-06-03 00:00:00,equali tee,,0.0
2015-06-03 00:00:00,grandmothers hillary,,0.0
2015-06-04 00:00:00, ,,0.0
2015-06-04 00:00:00,agree make easy possible every american citizen make voice heard,,0.6597
2015-06-04 00:00:00,automatic registration early voting fix voting rights act read hillary plan expand voting rights,,0.3182
2015-06-04 00:00:00,believe every citizen right vote believe make easier every citizen vote hillary,,0.4215
2015-06-04 00:00:00,congress move quickly repair damage voting rights act restore full protections american voters need deserve,,-0.25
2015-06-04 00:00:00,early person voting reduce long lines give citizens chance participate,,0.25
2015-06-04 00:00:00,eligible voter want registered registered voter period,,0.0772
2015-06-04 00:00:00,everything get young people engaged democracy less hillary,,0.4019
2015-06-04 00:00:00,fight us,,-0.3818
2015-06-04 00:00:00,hillary calls automatic voter registration everybody,,0.0
2015-06-04 00:00:00,hillary republican efforts make harder american citizens vote,,0.0
2015-06-04 00:00:00,implement commonsense reforms including expanding early absentee mail voting,,-0.2732
2015-06-04 00:00:00,need supreme court cares right vote person right buy election corporation,,0.765
2015-06-04 00:00:00,pop quiz following forms id use vote texas,,0.0
2015-06-04 00:00:00,read hillary full speech strengthening rights constitution democracy,,0.4939
2015-06-04 00:00:00,reforms commonsense ways strengthen democracy none come easily going take leadership,,0.068
2015-06-04 00:00:00,sc supposed one machine every voters minority areas rule often overlooked,,-0.0258
2015-06-04 00:00:00,set standard across country least days early person voting everywhere,,0.0
2015-06-04 00:00:00,sign agree hillary make voting easier harder,,0.6486
2015-06-04 00:00:00,today refuse allow country generation leaders slow reverse america long march toward perfect union,,0.5267
2015-06-05 00:00:00, ,,0.0
2015-06-05 00:00:00,hillary plans ensuring every citizen vote without barriers seconds,,0.2732
2015-06-05 00:00:00,today great headlines,,0.6249
2015-06-06 00:00:00,depth look hillary plan expanding voting rights gifs graphics,,0.0
2015-06-06 00:00:00,happening today silver state @hillaryfornv training organizers help elect hillary clinton fellowsnv,,0.4019
2015-06-06 00:00:00,last chance,,0.25
2015-06-06 00:00:00,like say arkansas,,0.3612
2015-06-06 00:00:00,recoge una copia del @elmundolv de hoy lee lo que dice @hillaryclinton sobre reforma migratoria,,0.0
2015-06-07 00:00:00,hillary new favorite singer,,0.4588
2015-06-07 00:00:00,spotted texas southern university,,0.0
2015-06-07 00:00:00,voting rights matter said,,0.0258
2015-06-08 00:00:00,helping women families succeed side issue fundamental economic future,,0.6597
2015-06-08 00:00:00,hillary without sign volunteer,,0.0
2015-06-08 00:00:00,knew liked @chipotle,,0.4215
2015-06-08 00:00:00,part team sign join official hillary list,,0.296
2015-06-08 00:00:00,prouder women team usa representing us stars stripes shin guards good luck @ussoccer wnt h,,0.8442
2015-06-09 00:00:00,chip keep using dollars important things sorry @johnpodesta,,0.128
2015-06-09 00:00:00,one debt college defrauded forgiving students right decision thx @usedgov h,,0.4404
2015-06-09 00:00:00,saturday big day host house party community join special call hillary,,0.765
2015-06-09 00:00:00,spotted instagram first hillary pride stickers arriving,,0.34
2015-06-10 00:00:00,coming soon hillary fights matter,,-0.3818
2015-06-10 00:00:00,first two months hillary campaign gif,,0.0
2015-06-10 00:00:00,hillary instagram follow along behind scenes look campaign,,0.0
2015-06-10 00:00:00,overheard ia nh sc nv voters share thoughts meeting hillary campaign trail,,0.6597
2015-06-10 00:00:00,today edition hillary supporters amazing things,,0.7717
2015-06-11 00:00:00,doting grandmother among things follow hillary new @instagram,,0.0
2015-06-11 00:00:00,group senators trying make medical decisions millions women leadership malpractice h,,0.0
2015-06-11 00:00:00,never seen today tbt pedal metal,,0.0
2015-06-11 00:00:00,pedal metal tbt,,0.0
2015-06-11 00:00:00,remembering historic day beijing september,,0.0
2015-06-11 00:00:00,team hillary instagram k strong join us,,0.6705
2015-06-11 00:00:00,want volunteer hillary let shake,,-0.1027
2015-06-12 00:00:00,everyone deserves champion corner life work running president h,,0.5994
2015-06-12 00:00:00,make hillary launch saved seat catch livestream,,0.4215
2015-06-12 00:00:00,nikki g indiana,,0.0
2015-06-12 00:00:00,setting stage official hillary launch tell us excited tomorrow,,0.34
2015-06-12 00:00:00,sports fans get game alerts hillary supporters get campaign updates sign get game,,0.4404
2015-06-12 00:00:00,state race campaign manager robby mook memo next phase hillary,,0.0
2015-06-12 00:00:00,take minutes watch look back big fights hillary career shaped,,-0.4019
2015-06-12 00:00:00,watching hillary launch via livestream tomorrow follow infographics personal stories,,0.0
2015-06-13 00:00:00, ,,0.0
2015-06-13 00:00:00,advantage hillary,,0.25
2015-06-13 00:00:00,advice kids dress job want,,0.0772
2015-06-13 00:00:00,born june women america right vote day,,0.0
2015-06-13 00:00:00,hillary first periscope hillary says hi earlier today michelle kwan reporting roosevelt island,,0.0
2015-06-13 00:00:00,hillary laid important policy positions particularly happy hear talk reproductive rights alex,,0.6997
2015-06-13 00:00:00,hillary listening en route iowa official hillary playlist @spotify,,0.0
2015-06-13 00:00:00,hillary ready fight every single one us sign hillary,,-0.0258
2015-06-13 00:00:00,hillary speech today little longer characters find whole thing,,0.0
2015-06-13 00:00:00,hillary strong values drive see got gretchen,,0.7184
2015-06-13 00:00:00,inscr bete para recibir textos de hillary su campa mande ir hillary,,0.0
2015-06-13 00:00:00,lesson hillary mom life happens happens get back,,0.0
2015-06-13 00:00:00,let build together,,0.0
2015-06-13 00:00:00,madam president madam president madam president,,0.0
2015-06-13 00:00:00,really loved brought clean energy climate change speech today louisa,,0.8503
2015-06-13 00:00:00,running president make economy work every american time let together h,,0.0
2015-06-13 00:00:00,specifically good hear hillary acknowledge income inequality dino,,0.4404
2015-06-13 00:00:00,team hillary,,0.0
2015-06-13 00:00:00,texts hillary start today text get texts campaign hillary,,0.0
2015-06-13 00:00:00,today hillary laid vision ready fight first stop iowa hillary,,-0.0772
2015-06-14 00:00:00,des moines see hillary iowa launch party watch live,,0.4019
2015-06-14 00:00:00,favorite part hillary official launch speech annotate using @genius,,0.4588
2015-06-14 00:00:00,hillary house parties nationwide us people deserve champion,,0.765
2015-06-14 00:00:00,miss hillary speech yesterday dive infographics stories,,-0.1531
2015-06-14 00:00:00,packed house waiting hear hillary iowa launch party des moines hillary,,0.4019
2015-06-14 00:00:00,spotted iowa talia talia grandma think time first girl president,,0.0
