date,clean_text,Unnamed: 2,compound_polarity
2013-06-10 00:00:00,thanks inspiration @asmith @sllambe take tweetsfromhillary,,0.743
2013-06-13 00:00:00,incredible twitter welcome hometown chicago cgiamerica amet talk bhccf work,,0.4588
2013-06-14 00:00:00,@ smalltofail new effort w @nextgen usa help kids crucial early years act,,0.4019
2013-06-14 00:00:00,much fun chelsea taking selfies back stage mt @chelseaclinton,,0.5106
2013-06-25 00:00:00,bill cheslea sent love prayers great friend madiba family nation difficult time,,0.875
2013-06-25 00:00:00,disappointed today decision striking heart voting rights act,,-0.4767
2013-06-26 00:00:00,applaud hard work everyone worked tirelessly make today possible,,0.3818
2013-07-10 00:00:00,@wpsproject bryn mawr inspiring women public sector jobs goal,,0.4215
2013-07-12 00:00:00,malala today un nothing changed life except weakness fear hopelessness died extraordinary young woman malaladay,,-0.9287
2013-07-17 00:00:00,went central pk zoo meet w wildlife experts elephants solution stop killing stop trafficking stop demand,,-0.8481
2013-07-18 00:00:00,today reminded invictus poem mandela used recite prison truly unconquerable soul madiba happy th birthday,,0.5106
2013-07-19 00:00:00,seneca falls years ago today began movement remains unfinished business st century,,0.0
2013-07-23 00:00:00,congratulations across pond duke duchess wishing best luck bit advice takes royal village,,0.9186
2013-08-09 00:00:00,bill chelsea back great bh ccf trip africa time bill big news potus,,0.6249
2013-08-15 00:00:00,@rachaelrad tweet ye shall receive see fellow downton abbey fan birds feather would seem,,0.3182
2013-08-16 00:00:00,bill wrote wonderful letter bhccf work proud accomplished know best yet come,,0.9313
2013-08-19 00:00:00,believe turned today look day four,,0.0
2013-09-02 00:00:00,flying countries lot consider swimming feels like swim sharks actually congrats,,0.7096
2013-09-13 00:00:00,@jk rowling look familiar hogwarts beautiful st andrews thanks grad student claire grand tour,,0.8689
2013-09-18 00:00:00,great st meeting @ smalltofail leadership advisory council yesterday good reading issue,,0.7906
2013-09-23 00:00:00,something know read new bio secretary albright plays drums welcome twitter @madeleine see cgi,,0.6124
2013-09-26 00:00:00,african nations ngos million path end elephant poaching @chelseaclinton thrilled,,0.4404
2013-09-26 00:00:00,proud done much join beijing,,0.6486
2013-10-01 00:00:00,cdf advocacy children began marian wright edelman continues w @ smalltofail,,0.0
2013-10-04 00:00:00,mom made reading @chelseaclinton priority every night new studies show us importance words,,0.3612
2013-10-11 00:00:00,@williamjhague great seeing today pleased special relationship continues even leaving office,,0.8658
2013-10-11 00:00:00,new profile pic honor international dayofthegirl join us clinton foundation celebrating,,0.8442
2013-10-25 00:00:00,@wef report women shows progress countries still address nov philadelphia,,0.4215
2013-11-01 00:00:00,ceilings full participation project new bhccf initiative accelerate progress women girls,,0.4215
2013-11-09 00:00:00,talking empower next generation la @chelseaclinton @ smalltofail @servicenation,,0.0
2013-11-12 00:00:00,backstage @gabbygiffords glamour women year awards incredible woman,,0.7506
2013-11-12 00:00:00,text aid give @mgivefoundation help typhoon haiyan disaster relief effort hope,,0.5574
2013-11-14 00:00:00,new op ed senator doctor friend bill frist @ smalltofail leadership council worth read,,0.6249
2013-11-14 00:00:00,went premiere white gold @museummodernart last night film narrated elephant poaching coming soon,,0.0
2013-11-16 00:00:00,secstate kerry spoke sat q @laurawbush fellow afghanwomen council co chair,,0.0
2013-11-16 00:00:00,secstates reunited @giwps today watching program backstage going discuss afghanwomen,,0.0
2013-11-25 00:00:00,great op ed another @ smalltofail leadership council member teacher @cindymccain read,,0.6249
2013-12-06 00:00:00,nelson mandela champion justice human dignity unmatched grace remember madiba truly unconquerable soul,,0.9371
2013-12-11 00:00:00,landed ny ukrainian government must follow madiba example choose dialogue people force,,0.0
2013-12-11 00:00:00,way back u madiba funeral watching going ukraine alarm,,-0.5994
2013-12-12 00:00:00,wishing good friend th secstate happy th birthday,,0.8934
2013-12-17 00:00:00,happens kids families cut unemployment insurance food stamps smalltofail deserve equal chance succeed,,0.0516
2013-12-18 00:00:00,excited report patti miller formerly @sesamestreet joined @clintonfdn co lead early childhood initiative @ smalltofail,,0.34
2013-12-24 00:00:00,merry xmas happy new year x thinking millions face challenges everyday looking forward much,,0.8176
2013-12-31 00:00:00,years ago proud begin working bipartisan efforts save unemployment insurance let quickly new year,,0.5267
2014-01-02 00:00:00,pleased proud see mayor @billdeblasio sworn today mt @billclinton great day nyc,,0.8779
2014-01-17 00:00:00,women live brink poverty us million children depend @shriverreport @amprog,,-0.5106
2014-01-21 00:00:00,teenager saw mlk speak chicago shook hand urged us stay engaged cause justice vital ever today,,0.8779
2014-02-03 00:00:00,much fun watch fox someone else blitzed sacked superbowl,,0.5106
2014-02-05 00:00:00,join @ smalltofail @unicontigo help close word gap take pledge,,0.5994
2014-02-12 00:00:00,briefed old @whitehouse colleagues yesterday new wildlife trafficking report good progress made,,0.6908
2014-02-13 00:00:00,headed chappaqua snowy morning talk @melindagates data important women girls noceilings,,0.2023
2014-02-14 00:00:00,@billclinton needed good pair snow boots watch event noceilings,,0.4404
2014-02-26 00:00:00,team beijing declared women rights human rights great reunion today work,,0.6249
2014-02-27 00:00:00,encouraging news today china business leaders stopping demand ivory,,0.3182
2014-03-08 00:00:00,@un secgen ban ki moon @phumzileunwomen great see @un women yesterday watch,,0.128
2014-03-08 00:00:00,iwd celebrate work eleanor roosevelt courageous advocate human rights work continues inspire noceilings,,0.8957
2014-03-22 00:00:00,freedom speak connect fundamental right people turkey deserve right restored twitterisblockedinturkey,,0.765
2014-03-22 00:00:00,great back arizona @senjohnmccain @cindymccain cgiu looking forward weekend @asu,,0.6249
2014-03-23 00:00:00,today @cgiu mt @jimmykimmel @theellenshow clintons kimmel @billclinton @chelseaclinton selfie,,0.0
2014-03-25 00:00:00,@tulsaeducare @gkff @ smalltofail great day launching talkingisteachingtulsa made new friends,,0.802
2014-04-01 00:00:00,well explains happened ipad @billclinton following leader,,0.2732
2014-04-02 00:00:00,majority lower wage jobs held women raising minimum wage good women economy,,0.1779
2014-04-04 00:00:00,great meet strong brave young women pussyriot refuse let voices silenced russia,,0.8625
2014-04-09 00:00:00,years ago women made cents dollar men today still cents work equalpay noceilings,,0.0
2014-04-12 00:00:00,good luck friend former colleague deputy secretary bill burns treasure american diplomacy,,0.8834
2014-04-17 00:00:00,exciting title yet grandmother @billclinton thrilled chelsea marc expecting first child,,0.7269
2014-04-29 00:00:00,heart arkansas elsewhere path terrible tornados,,-0.4767
2014-05-04 00:00:00,access education basic right unconscionable reason target innocent girls must stand terrorism bringbackourgirls,,-0.4939
2014-05-11 00:00:00,@voguemagazine thank anna wishing mothers happy mother day looking forward celebrating new mother soon,,0.8957
2014-05-17 00:00:00,little rock today dale leslie chihuly opening spectacular new exhibit @clintoncenter,,0.0
2014-05-24 00:00:00,happy th birthday former colleagues foreign service honor spend years working fs,,0.7845
2014-05-24 00:00:00,meriam yahya ibrahim death sentence abhorrent sudan stop threatening religious freedom fundamental human rights,,-0.8442
2014-05-29 00:00:00,miss friend mayaangelou truly phenomenalwoman,,0.6705
2014-05-30 00:00:00,came across photo morning saw others sharing thought would mayaangelou,,0.4215
2014-06-02 00:00:00,@clintonfdn say together read charles blow nyt column morning yesallofus,,0.0
2014-06-22 00:00:00,@katyperry well hard choice already keep letting us hear roar,,0.1779
2014-06-23 00:00:00,national paid family leave benefits families economy get facts visit,,0.34
2014-06-26 00:00:00,@ smalltofail kids big advocate @whitehouse reminding parents caregivers talkingisteaching,,0.0
2014-06-27 00:00:00,heartbreaking news vital voice justice silenced,,0.3818
2014-06-30 00:00:00,hard working women pay price today two troubling scotus decisions wages health care dignity,,0.1531
2014-07-02 00:00:00,stopped @hudsonbooks jfk flight london taking hardchoices book tour across pond,,-0.2263
2014-07-04 00:00:00,@ smalltofail @essencemag team close word gap help parents talk read sing kids,,0.4019
2014-07-18 00:00:00,great see @billclinton taking noceilings road india talk women economy,,0.6249
2014-07-21 00:00:00,siliconvalley today visiting @google @facebook @twitter looking forward seeing everyone answering questions,,0.0
2014-07-21 00:00:00,way @twitter tweet questions askhillary watch conversation @katies,,0.0
2014-07-21 00:00:00,year tweetsfromhillary want hear pm pt @twitter q hardchoices askhillary,,0.0772
2014-07-23 00:00:00,way oakland excited announce new @ smalltofail campaign letstalkoakland,,0.34
2014-07-26 00:00:00,come oakland let great rallying cry @urbanstratoak talking reading singing matters,,0.2732
2014-08-06 00:00:00,ireadeverywhere w @nypl reminded moments reading chelsea little let closethewordgap,,0.0
2014-08-19 00:00:00,happy birthday wonderful husband today,,0.8126
2014-09-04 00:00:00,broken bread w fellow secstates never broken ground great visit @statedept yesterday,,-0.8589
2014-09-15 00:00:00,congratulations california winning paidsickdays help million workers weallgetsick,,0.875
2014-09-23 00:00:00,proud announce jobone commitments cgi create job pathways youth join us @clintonglobal,,0.7845
2014-09-24 00:00:00,girlscharge commits help million girls get access secondary school noceilings cgi smartthingtodo,,0.4215
2014-09-27 00:00:00,@billclinton moon grandparents one happiest moments life,,0.6369
2014-10-03 00:00:00,kathryn bigelow new short last days makes case poaching terrorism connected matters,,-0.6705
2014-10-04 00:00:00,hopeful see nyc lead way raising wages working families thanks mr mayor,,0.7351
2014-10-08 00:00:00,love innovative investments close wordgap opportunity gap chicago kids cc @ smalltofail,,0.872
2014-10-10 00:00:00,congratulations malala yousafzai kailash satyarthi tireless champions education freedom every girl boy,,0.91
2014-10-12 00:00:00,proud launch new toolkit aap help pediatricians parents talk read sing babies @ smalltofail,,0.7003
2014-10-25 00:00:00,new @oppnation data shows encouraging news youth employment much read jobone,,0.5267
2014-11-11 00:00:00,thinking dad today others served veteransday,,0.0
2014-11-20 00:00:00,memphis @stjude children hospital dedicate marlo thomas center see new proton therapy center,,0.0
2014-11-20 00:00:00,quality child care makes families communities stronger thanks president signing bipartisan child care bill @ smalltofail,,0.8979
2014-11-21 00:00:00,thanks potus taking action immigration face inaction let turn permanent bipartisan reform immigrationaction,,0.2263
2014-11-22 00:00:00,went @cookstoves summit yesterday w global industry leaders focused worthy mission cooking kill,,-0.0516
2014-11-27 00:00:00,today thankful new addition family thinking little ones everywhere happy thanksgiving cc @ smalltofail,,0.7984
2014-12-02 00:00:00,let join @pepfar @gatesfoundation @girleffect fighting aids free future girls wad,,0.4588
2014-12-06 00:00:00,important fundraising drive @wfp donate create lifeline syrian refugees adollaralifeline,,0.4404
2015-01-16 00:00:00,attacking financial reform risky wrong better congress focus jobs wages middle class families,,-0.6124
2015-01-20 00:00:00,would mlk say today great strides miles go keep fight injustice mlkday,,-0.296
2015-01-21 00:00:00,@barackobama sotu pointed way economy works need step deliver middle class fairshot fairshare,,0.0
2015-01-22 00:00:00,looks like @elmo enjoyed reading @chelseaclinton sang baby tinear @ smalltofail,,0.7003
2015-01-24 00:00:00,@madeleine must something water @wellesley yougogirl,,0.0
2015-01-24 00:00:00,never forget watching ernie banks play broke barriers loved baseball life miss mr cub letsplaytwo,,0.5523
2015-02-03 00:00:00,science clear earth round sky blue vaccineswork let protect kids grandmothersknowbest,,0.6369
2015-02-14 00:00:00,@bfrist may agree everything see believe kids health insurance priority commonground,,0.3612
2015-02-14 00:00:00,@billclinton date,,0.0
2015-02-14 00:00:00,good week philadelphia,,0.4404
2015-02-26 00:00:00,yesterday met star women tech silicon valley girlscancode anywhere everywhere interesting story,,0.4019
2015-03-05 00:00:00,want public see email asked state release said review release soon possible,,0.0772
2015-03-07 00:00:00,watched @repjohnlewis @barackobama selma let answer call keep fighting voting rights civil rights human rights,,-0.3612
2015-03-08 00:00:00,see new profile pic raise awareness far come reaching equal rights women girls worldwide,,0.2023
2015-03-09 00:00:00,excited share noceilings data hope dive use share learn get motivated,,0.8934
2015-03-11 00:00:00,gop letter iranian clerics undermines american leadership one considering running commander chief signing,,-0.34
2015-03-16 00:00:00,congressional trifecta women today blocking great nominee st african american woman ag longer ag years,,0.3612
2015-03-16 00:00:00,playing politics trafficking victims threatening women health rights,,-0.5994
2015-03-18 00:00:00,budgets reflect priorities help families get ahead educate kids spark small business growth,,0.7351
2015-03-18 00:00:00,making college affordable investment kids economic growth cuts pell grants hold kids back,,0.3182
2015-03-18 00:00:00,nation future jobs economic growth depends investments made today gop budget fails americans principles,,-0.0516
2015-03-18 00:00:00,repeal aca would let insurers write rules wipe coverage million americans,,0.0
2015-03-23 00:00:00,aca@ covered young ppl preexisting conditions women get better coverage repeal things embrace,,0.6369
2015-03-26 00:00:00,protecting pregnant women discrimination fight american apple pie,,-0.3818
2015-03-27 00:00:00,loved serving w @senatorreid true friend partner fighter middle class big loss senate nevada country thanksharry,,0.8481
2015-03-27 00:00:00,sad new indiana law happen america today discriminate ppl bc love lgbt,,0.2732
2015-03-28 00:00:00,abusive payday lenders take advantage families trying get ahead glad see @barackobama @cfpb take stand,,-0.0516
2015-04-01 00:00:00,like law ar bill goes beyond protecting religion would permit unfair discrimination lgbt americans urge governor veto,,-0.1531
2015-04-07 00:00:00,detention women activists china must end inexcusable freebeijing five read story,,-0.3612
2015-04-09 00:00:00,praying walterscott family heartbreaking familiar better rebuild trust reform justice system respect lives,,0.9042
2015-04-12 00:00:00,account run campaign staff still see tweets hillary signed h,,0.0
2015-04-12 00:00:00,estoy postul ndome para presidente todos los estadounidenses necesitan un defensor yo quiero ser ese defensor h,,0.0
2015-04-12 00:00:00,hillary one starting new chapter watch hillary,,0.0
2015-04-12 00:00:00,hitting trail earn vote headed iowa h,,0.0
2015-04-12 00:00:00,part campaign beginning,,0.0
2015-04-12 00:00:00,pitch today piece campaign start hillary,,0.0
2015-04-12 00:00:00,running president everyday americans need champion want champion h,,0.8442
2015-04-13 00:00:00,part campaign,,0.0
2015-04-13 00:00:00,road trip loaded van set ia met great family stopped afternoon many come h,,0.4939
2015-04-14 00:00:00,describes equalpayday,,0.0
2015-04-14 00:00:00,fair say deck still stacked favor already top something wrong,,0.4019
2015-04-14 00:00:00,heard coming figured oughta welcome,,0.4588
2015-04-14 00:00:00,hillary iowa afternoon want champion goes bat americans four big areas,,0.6369
2015-04-14 00:00:00,hillary laying priorities country,,0.0
2015-04-14 00:00:00,hillary talking education college affordability students kirkwood community college,,0.0
2015-04-14 00:00:00,iowa begin conversation,,0.0
2015-04-14 00:00:00,like road trips campaigns better friends along ride reply tag friend join,,0.9169
2015-04-14 00:00:00,need build economy tomorrow yesterday,,0.0
2015-04-14 00:00:00,need fix dysfunctional political system get unaccountable money,,0.0
2015-04-14 00:00:00,need protect country threats see ones horizon,,-0.0516
2015-04-14 00:00:00,need strengthen families communities starts,,0.3182
2015-04-14 00:00:00,putting hillary bold good use,,0.6705
2015-04-14 00:00:00,thought day going go woke morning nikki lisa cedar rapids,,0.0
2015-04-15 00:00:00,high fives marshalltown iowa,,0.0
2015-04-15 00:00:00,hillary capital city fruit norwalk ia offering specific ideas jumpstart small businesses,,0.0
2015-04-15 00:00:00,hillary deck still stacked favor top need shuffle cards need play different hand,,0.8442
2015-04-15 00:00:00,hillary trail iowa today follow @hillaryforia updates,,0.0
2015-04-15 00:00:00,photos trail head new flickr page,,0.0
2015-04-15 00:00:00,saying hi capital city fruit norwalk iowa,,0.0
2015-04-16 00:00:00,bye iowa thank loved talking many mind ideas future see soon h,,0.7506
2015-04-16 00:00:00,celebrating nationalhighfiveday,,0.5719
2015-04-16 00:00:00,deck still stacked favor already top something wrong,,0.1027
2015-04-16 00:00:00,every american deserves fair shot success fast food child care workers march streets living wages h,,0.8481
2015-04-16 00:00:00,hey joined hillary yet,,0.0
2015-04-16 00:00:00,hillary discusses paid leave iowa children deserve chances,,0.1531
2015-04-16 00:00:00,hillary excited really excited starting campaign talking people really stake,,0.5859
2015-04-16 00:00:00,one coffee road hillary council bluffs iowa today,,0.0
2015-04-16 00:00:00,still time become founding donor hillary,,0.0
2015-04-16 00:00:00,tbt wellesley,,0.0
2015-04-17 00:00:00,court hears immigration case today stake stronger families communities economy parents dreamers live fear h,,-0.1531
2015-04-17 00:00:00,ff @hillaryforia @hillaryfornh @hillaryforsc @hillaryfornv news organizers volunteers making happen,,0.4215
2015-04-17 00:00:00,like gal,,0.3612
2015-04-18 00:00:00,head facebook photo recap hillary trip iowa,,0.0
2015-04-18 00:00:00,hillary america let go,,0.0
2015-04-19 00:00:00,@billclinton ok city today live oklahoma standard service honor kindness affirm common humanity,,0.8126
2015-04-20 00:00:00,congrats runners boston marathon today power supportive families friends braving rain h bostonstrong,,0.8271
2015-04-20 00:00:00,getting ready order kristin bistro bakery keene new hampshire first stop granite state,,0.0772
2015-04-20 00:00:00,hat envy keene nh,,0.2732
2015-04-20 00:00:00,hillary campaign kick trip iowa seconds,,0.0
2015-04-20 00:00:00,saying hi whitney brothers inc furniture maker keene nh,,0.4939
2015-04-21 00:00:00,future engineer aurora says girls anything put mind hillary music ears,,0.0
2015-04-21 00:00:00,inspiration fix meeting students nhti hillaryinnh,,0.5267
2015-04-21 00:00:00,kicking day two new hampshire follow @hillaryfornh updates trail,,0.0
2015-04-21 00:00:00,taking democratic history new hampshire,,0.0
2015-04-22 00:00:00,fight believe exists climate change real must meet challenge earthday h,,-0.3182
2015-04-22 00:00:00,hillary wrapped two whirlwind days nh see photos @hillaryfornh trip,,0.4939
2015-04-22 00:00:00,organizing heart soul campaign watch video sign get involved,,0.0
2015-04-22 00:00:00,organizing teams ramping states ready get involved sign,,0.3612
2015-04-23 00:00:00,hillary bumper stickers arrived send one free,,0.5106
2015-04-23 00:00:00,neighbors talking neighbors politics way,,0.0
2015-04-23 00:00:00,students hiring apply hillary intern tag friends spread word,,0.4767
2015-04-23 00:00:00,waiting months say congratulations loretta lynch officially confirmed next ag great news america h,,0.8402
2015-04-23 00:00:00,way go,,0.0
2015-04-24 00:00:00,@gabbygiffords always inspiring see resilience bravery sheer determination personified h,,0.8271
2015-04-24 00:00:00,agree hillary women,,0.3612
2015-04-24 00:00:00,campaign starts sign part,,0.0
2015-04-24 00:00:00,looking engineers help create next big thing digital campaigning apply,,0.5859
2015-04-24 00:00:00,send free hillary bumper sticker,,0.5106
2015-04-25 00:00:00,hillary counting get involved sign part campaign,,0.0
2015-04-25 00:00:00,thoughts prayers people nepal h,,0.0
2015-04-26 00:00:00,icymi watch hillary keynote speech @womenintheworld,,0.0
2015-04-26 00:00:00,step get free bumper sticker step stick something,,0.5106
2015-04-27 00:00:00,miss chance get free hillary bumper sticker,,0.5719
2015-04-27 00:00:00,read hillary thank note iowa,,0.3612
2015-04-27 00:00:00,start week right sign join hillary,,0.296
2015-04-28 00:00:00,every loving couple family deserves recognized treated equally law across nation lovemustwin lovecantwait h,,0.5994
2015-04-28 00:00:00,hillary grandpa iowa talk marriage equality coffee lovemustwin lovecantwait,,0.0
2015-04-28 00:00:00,join team think everyone able marry person love,,0.7506
2015-04-28 00:00:00,numbers hillary analytics team looking nerds passion data apply join team,,0.6369
2015-04-28 00:00:00,standing jared nate hillary equal rights lovecantwait lovemustwin,,0.0
2015-04-28 00:00:00,tonight praying peace safety baltimore freddie gray family death tragedy demands answers h,,-0.128
2015-04-29 00:00:00,agree need address inequality expand economic opportunity sign part hillary,,0.765
2015-04-29 00:00:00,congrats @johnkerry nd qddr honing diplomacy development core pillars power along w defense h,,0.5994
2015-04-29 00:00:00,end mass incarceration address inequality restore trust law enforcement communities read share,,0.7717
2015-04-29 00:00:00,hillary reforming criminal justice system rebuilding respect embracing common humanity,,0.4767
2015-04-29 00:00:00,hillary struck line read times read full @usatoday piece,,-0.25
2015-04-29 00:00:00,make sure every police department country body cameras record interactions officers patrol suspects,,-0.0258
2015-04-29 00:00:00,need start understanding important care every single child though child,,0.6124
2015-04-29 00:00:00,need strategies fight crime restore trust law enforcement communities especially communities color,,-0.1531
2015-04-29 00:00:00,quiet epidemic substance abuse sweeping small town rural america need get serious treatment,,-0.6705
2015-04-29 00:00:00,take broader inequities society separate unrest streets cycles poverty despair communities,,-0.6808
2015-04-29 00:00:00,time,,0.0
2015-04-29 00:00:00,time change approach time end era mass incarceration hillary dinkinsforum,,0.0
2015-04-29 00:00:00,watch hillary calls end era mass incarceration,,0.0
2015-04-30 00:00:00,agree bernie focus must helping america middle class gop would hold back welcome race h,,0.7717
2015-04-30 00:00:00,hillary digital team looking engineers passion politics apply join team hq,,0.6369
2015-04-30 00:00:00,show hillary pride free sticker,,0.6908
2015-05-01 00:00:00,amen headline @pontifex hope see voices speaking h,,0.4404
2015-05-01 00:00:00,claimed hillary pride sticker yet sign free,,0.6908
2015-05-01 00:00:00,get hillary bumper sticker gone,,0.0
2015-05-01 00:00:00,happy aapi heritage month asian americans pacific islanders contributed making country stronger agree,,0.8316
2015-05-01 00:00:00,hillary protect women ability make health decisions say,,0.5994
2015-05-02 00:00:00,building organization across country grassroots part,,0.0
2015-05-03 00:00:00,mother day gift idea call hillary sign chance surprise mom love,,0.8807
2015-05-03 00:00:00,sign chance give mother day gift remember,,0.5994
2015-05-04 00:00:00,hillary wants call someone mom mother day could,,0.0
2015-05-04 00:00:00,join hillary believe creating opportunities everyone follow dream,,0.7906
2015-05-05 00:00:00,@realgabbyr @hillaryforia said congrats,,0.5267
2015-05-05 00:00:00,fight comprehensive immigration reform path citizenship families across country,,-0.1531
2015-05-05 00:00:00,fight stop partisan attacks executive actions would put dreamers including many us today risk deportation,,-0.8316
2015-05-05 00:00:00,fix broken immigration system family issue,,-0.4767
2015-05-05 00:00:00,get facts fight back false attacks sign @thebriefing,,-0.6705
2015-05-05 00:00:00,gop candidate consistently supported path citizenship talk legal status code nd class status,,0.4215
2015-05-05 00:00:00,gop debates failed policies democrats debate help families get ahead looking forward real conversation h,,-0.1531
2015-05-05 00:00:00,happy nationalteacherday teachers educate inspire classroom,,0.8126
2015-05-05 00:00:00,hillary clinton conversa sobre la reforma migratoria con un grupo de dreamers en nevada sintoniza aqu,,0.0
2015-05-05 00:00:00,kind student every family every community proud hillary rancho hs student daca recipient betsaida,,0.7579
2015-05-05 00:00:00,much expand protections families communities keep building support comprehensive reform,,0.7184
2015-05-05 00:00:00,put place accessible way parents dreamers others eligible deferred action children,,0.0
2015-05-05 00:00:00,put social media savvy good use digital team hillary hq,,0.4404
2015-05-05 00:00:00,think beyond candy flowers mother day get mom call hillary,,0.0
2015-05-05 00:00:00,wait longer path full equal citizenship,,0.0
